name,url,description,size,stars,watchers,language,forks,commits,authors,lines_of_code,lines_of_comments,lines_blank
eclipse_leshan,https://github.com/eclipse/leshan,Eclipse Leshan is an OMA Lightweight M2M (LWM2M) implementation in Java.,4538,339,339,Java,247,1720,82,-1,-1,-1
konsoletyper_teavm,https://github.com/konsoletyper/teavm,Compiler of Java bytecode to JavaScript,42607,1199,1199,Java,140,2559,57,-1,-1,-1
pentaho_mondrian,https://github.com/pentaho/mondrian,Mondrian is an Online Analytical Processing (OLAP) server that enables business users to analyze large quantities of data in real-time.,312754,780,780,Java,605,7387,262,-1,-1,-1
ThreeTen_threeten-extra,https://github.com/ThreeTen/threeten-extra,Provides additional date-time classes that complement those in JDK 8,1508,218,218,Java,54,980,47,-1,-1,-1
react-native-kit_react-native-track-player,https://github.com/react-native-kit/react-native-track-player,"A fully fledged audio module created for music apps. Provides audio playback, external media controls, chromecast support, background mode and more!",3666,811,811,Java,229,893,83,-1,-1,-1
apache_camel,https://github.com/apache/camel,Apache Camel,282025,2732,2732,Java,3559,60887,1288,-1,-1,-1
aseldawy_spatialhadoop2,https://github.com/aseldawy/spatialhadoop2,The second generation of SpatialHadoop that ships as an extension,23346,126,126,Java,93,1781,37,-1,-1,-1
apache_sqoop,https://github.com/apache/sqoop,Mirror of Apache Sqoop,18720,602,602,Java,429,3111,120,-1,-1,-1
zmxv_react-native-sound,https://github.com/zmxv/react-native-sound,React Native module for playing sound clips,278,1858,1858,Java,522,581,173,-1,-1,-1
trol73_mucommander,https://github.com/trol73/mucommander,trolCommander - fork of muCommander file manager,118140,169,169,Java,37,741,28,-1,-1,-1
jeddict_jeddict,https://github.com/jeddict/jeddict,Java EE 8 (Jakarta EE) & MicroProfile 2.0 application generator and modeler,55707,316,316,Java,36,861,10,-1,-1,-1
SleepyTrousers_EnderIO,https://github.com/SleepyTrousers/EnderIO,,65599,528,528,Java,268,8654,231,-1,-1,-1
crawler-commons_crawler-commons,https://github.com/crawler-commons/crawler-commons,A set of reusable Java components that implement functionality common to any web crawler,2885,135,135,Java,58,644,30,-1,-1,-1
hibernate_hibernate-tools,https://github.com/hibernate/hibernate-tools,"Code generation, reverse engineering, ant task and more tools for Hibernate Core",39863,207,207,Java,190,2726,48,-1,-1,-1
MrCrayfish_MrCrayfishFurnitureMod,https://github.com/MrCrayfish/MrCrayfishFurnitureMod,A Furniture Mod for Minecraft. Download ▶,11822,133,133,Java,94,1008,62,-1,-1,-1
fnproject_fdk-java,https://github.com/fnproject/fdk-java,Java API and runtime for fn.,3199,115,115,Java,40,1048,58,-1,-1,-1
genonbeta_TrebleShot,https://github.com/genonbeta/TrebleShot,"An Open-Source Android application that allows you to send and receive files over available connections, and pause and resume transfer process even after something went wrong.",54081,283,283,Java,53,1239,66,-1,-1,-1
SBPrime_AsyncWorldEdit,https://github.com/SBPrime/AsyncWorldEdit,Async WorldEdit - Edit millions of blocks without lag!,19972,106,106,Java,65,626,32,-1,-1,-1
react-native-community_react-native-image-picker,https://github.com/react-native-community/react-native-image-picker,:sunrise_over_mountains: A React Native module that allows you to use native UI to select media from the device library or directly from the camera.,1425,5467,5467,Java,1264,1047,297,-1,-1,-1
apache_jena,https://github.com/apache/jena,Mirror of Apache Jena,413084,556,556,Java,424,44896,153,-1,-1,-1
cloudfoundry_uaa,https://github.com/cloudfoundry/uaa,CloudFoundry User Account and Authentication (UAA) Server,53081,1003,1003,Java,651,10626,365,-1,-1,-1
TeamAmaze_AmazeFileManager,https://github.com/TeamAmaze/AmazeFileManager,Material design file manager for Android,45691,2558,2558,Java,888,4398,178,-1,-1,-1
jpmml_jpmml-model,https://github.com/jpmml/jpmml-model,Java Class Model API for PMML,1374,109,109,Java,44,736,1,-1,-1,-1
grpc_grpc-java,https://github.com/grpc/grpc-java,The Java gRPC implementation. HTTP/2 based RPC,36226,6221,6221,Java,2005,11252,372,-1,-1,-1
k3b_APhotoManager,https://github.com/k3b/APhotoManager,"Manage local photos on Android: gallery, geotag with photomap, privacy, tags, find, sort, view, copy, send, ... .",7390,109,109,Java,43,992,6,-1,-1,-1
AnyChart_AnyChart-Android,https://github.com/AnyChart/AnyChart-Android,AnyChart Android Chart is an amazing data visualization library for easily creating interactive charts in Android apps. It runs on API 19+ (Android 4.4) and features dozens of built-in chart types.,53070,699,699,Java,133,510,8,-1,-1,-1
square_keywhiz,https://github.com/square/keywhiz,A system for distributing and managing secrets,4242,2098,2098,Java,166,1027,49,-1,-1,-1
Etar-Group_Etar-Calendar,https://github.com/Etar-Group/Etar-Calendar,Android open source calendar,33644,676,676,Java,225,6108,214,-1,-1,-1
hypothesis_browser-extension,https://github.com/hypothesis/browser-extension,The Hypothesis browser extensions.,8674,111,111,Java,50,779,32,-1,-1,-1
linkedin_TonY,https://github.com/linkedin/TonY,TonY is a framework to natively run deep learning frameworks on Apache Hadoop.,2099,500,500,Java,103,784,25,-1,-1,-1
TNG_junit-dataprovider,https://github.com/TNG/junit-dataprovider,A TestNG like dataprovider runner for JUnit with many additional features,1265,198,198,Java,32,525,22,-1,-1,-1
SpongePowered_SpongeForge,https://github.com/SpongePowered/SpongeForge,A Forge mod that implements SpongeAPI,8208,1014,1014,Java,335,5261,170,-1,-1,-1
spring-projects_spring-data-solr,https://github.com/spring-projects/spring-data-solr,Spring Data - Apache Solr integration,5284,333,333,Java,230,1787,92,-1,-1,-1
bluestreak01_questdb,https://github.com/bluestreak01/questdb,QuestDB is a relational database that natively supports time series data,29943,149,149,Java,19,1999,11,-1,-1,-1
apache_lucene-solr,https://github.com/apache/lucene-solr,Mirror of Apache Lucene + Solr,405670,2746,2746,Java,1926,91436,714,-1,-1,-1
perfectsense_brightspot-cms,https://github.com/perfectsense/brightspot-cms,Brightspot is an enterprise user experience platform built on top of the Dari Framework.,72703,133,133,Java,54,9036,80,-1,-1,-1
OpenHFT_Chronicle-Bytes,https://github.com/OpenHFT/Chronicle-Bytes,Chronicle Bytes has a similar purpose to Java NIO's ByteBuffer with many extensions,301809,164,164,Java,47,7738,64,-1,-1,-1
FireNio_firenio,https://github.com/FireNio/firenio,🐳🐳An easy of use io framework project based on java nio,602,224,224,Java,86,1754,8,-1,-1,-1
thingsboard_thingsboard,https://github.com/thingsboard/thingsboard,"Open-source IoT Platform - Device management, data collection, processing and visualization.",13033,3788,3788,Java,1281,3034,181,-1,-1,-1
breadwallet_breadwallet-android,https://github.com/breadwallet/breadwallet-android,android SPV bitcoin wallet,66757,229,229,Java,324,4528,62,-1,-1,-1
laurent-clouet_sheepit-client,https://github.com/laurent-clouet/sheepit-client,"Client for the free and distributed render farm ""SheepIt Render Farm""",7589,185,185,Java,59,1028,54,-1,-1,-1
Rajawali_Rajawali,https://github.com/Rajawali/Rajawali,Android OpenGL ES 2.0/3.0 Engine,83521,1873,1873,Java,639,2597,106,-1,-1,-1
embulk_embulk,https://github.com/embulk/embulk,Embulk: Pluggable Bulk Data Loader.,6053,1296,1296,Java,162,3277,94,-1,-1,-1
alkacon_opencms-core,https://github.com/alkacon/opencms-core,The Java open source content management system by Alkacon Software,972927,413,413,Java,332,27065,141,-1,-1,-1
Team-RTG_Realistic-Terrain-Generation,https://github.com/Team-RTG/Realistic-Terrain-Generation,The Realistic Terrain Generation mod for Minecraft.,26799,179,179,Java,91,4438,33,-1,-1,-1
rrd4j_rrd4j,https://github.com/rrd4j/rrd4j,A high performance data logging and graphing system for time series data.,6234,204,204,Java,55,703,30,-1,-1,-1
saket_Dank,https://github.com/saket/Dank,,7427,650,650,Java,99,1907,6,-1,-1,-1
mozilla-mobile_focus-android,https://github.com/mozilla-mobile/focus-android,Firefox Focus: The privacy browser - Browse like no one’s watching.,165221,1349,1349,Java,485,6638,208,-1,-1,-1
VoltDB_voltdb,https://github.com/VoltDB/voltdb,VoltDB,650380,1428,1428,Java,378,48190,323,-1,-1,-1
spotbugs_sonar-findbugs,https://github.com/spotbugs/sonar-findbugs,SpotBugs plugin for SonarQube,1354,137,137,Java,74,709,60,-1,-1,-1
openmrs_openmrs-contrib-android-client,https://github.com/openmrs/openmrs-contrib-android-client,Android client for OpenMRS,101444,103,103,Java,250,1668,157,-1,-1,-1
cinchapi_concourse,https://github.com/cinchapi/concourse,"Distributed database warehouse for transactions, search and analytics across time.",40709,312,312,Java,260,6437,69,-1,-1,-1
tonihele_OpenKeeper,https://github.com/tonihele/OpenKeeper,Dungeon Keeper II remake,9527,210,210,Java,25,2197,20,-1,-1,-1
LambdaInnovation_AcademyCraft,https://github.com/LambdaInnovation/AcademyCraft,A Minecraft mod about superability,67375,146,146,Java,41,2387,52,-1,-1,-1
UniversaBlockchain_universa,https://github.com/UniversaBlockchain/universa,"Universa network, node, client and API",34649,319,319,Java,96,2290,18,-1,-1,-1
aol_cyclops,https://github.com/aol/cyclops,"An advanced, but easy to use, platform for writing functional applications in Java 8.",35789,966,966,Java,101,4076,50,-1,-1,-1
ff4j_ff4j,https://github.com/ff4j/ff4j,Feature Flags for Java made easy,9666,579,579,Java,160,990,89,-1,-1,-1
doocs_leetcode,https://github.com/doocs/leetcode,😏 LeetCode solutions in any programming language,2957,315,315,Java,145,927,46,-1,-1,-1
BitwiseInc_Hydrograph,https://github.com/BitwiseInc/Hydrograph,A visual ETL development and debugging tool for big data,35071,126,126,Java,95,549,63,-1,-1,-1
apache_asterixdb,https://github.com/apache/asterixdb,Mirror of Apache AsterixDB,162743,149,149,Java,85,7781,146,-1,-1,-1
aws_aws-sdk-java,https://github.com/aws/aws-sdk-java,The official AWS SDK for Java.,1297414,2974,2974,Java,2255,2835,483,-1,-1,-1
shyiko_mysql-binlog-connector-java,https://github.com/shyiko/mysql-binlog-connector-java,MySQL Binary Log connector,1427,1155,1155,Java,401,607,56,-1,-1,-1
aimacode_aima-java,https://github.com/aimacode/aima-java,"Java implementation of algorithms from Russell And Norvig's ""Artificial Intelligence - A Modern Approach""",701151,1102,1102,Java,615,3869,100,-1,-1,-1
chewiebug_GCViewer,https://github.com/chewiebug/GCViewer,"Fork of tagtraum industries' GCViewer. Tagtraum stopped development in 2008, I aim to improve support for Sun's / Oracle's java 1.6+ garbage collector logs (including G1 collector)",6457,2668,2668,Java,642,800,69,-1,-1,-1
gojek_feast,https://github.com/gojek/feast,Feature Store for Machine Learning,2494,381,381,Java,50,640,22,-1,-1,-1
mesosphere_dcos-cassandra-service,https://github.com/mesosphere/dcos-cassandra-service,DEPRECATED—Open source Apache Cassandra running on DC/OS is now replaced by mesosphere/dcos-commons/frameworks/cassandra.  This repository will be deleted at the end of 2017.,67342,118,118,Java,59,1743,83,-1,-1,-1
yaxim-org_yaxim,https://github.com/yaxim-org/yaxim,yaxim - a lean XMPP/Jabber client for Android,15648,450,450,Java,238,0,0,-1,-1,-1
schildbach_public-transport-enabler,https://github.com/schildbach/public-transport-enabler,Unleash public transport data in your Java project.,6331,226,226,Java,104,2708,91,-1,-1,-1
tonikelope_megabasterd,https://github.com/tonikelope/megabasterd,Yet another unofficial (and ugly) cross-platform MEGA downloader/uploader/streaming suite.,93554,221,221,Java,34,7693,9,-1,-1,-1
bootique_bootique,https://github.com/bootique/bootique,Bootique is a minimally opinionated platform for modern runnable Java apps.,3701,1170,1170,Java,270,1269,28,-1,-1,-1
javers_javers,https://github.com/javers/javers,JaVers - object auditing and diff framework for Java,7792,517,517,Java,165,2641,139,-1,-1,-1
deltachat_deltachat-android,https://github.com/deltachat/deltachat-android,Email-based instant messaging for Android.,75566,396,396,Java,65,3301,48,-1,-1,-1
graphql-java-kickstart_graphql-java-servlet,https://github.com/graphql-java-kickstart/graphql-java-servlet,Servlet endpoint for GraphQL Java,844,116,116,Java,70,578,51,-1,-1,-1
AnghelLeonard_Hibernate-SpringBoot,https://github.com/AnghelLeonard/Hibernate-SpringBoot,Collection of best practices for Java persistence performance in Spring Boot applications,28376,168,168,Java,67,1271,1,-1,-1,-1
ldtteam_minecolonies,https://github.com/ldtteam/minecolonies,Minecolonies minecraft mod,76881,177,177,Java,109,14347,150,-1,-1,-1
SourceLabOrg_kafka-webview,https://github.com/SourceLabOrg/kafka-webview,Full-featured web-based Apache Kafka consumer UI,2903,213,213,Java,46,663,10,-1,-1,-1
spotify_apollo,https://github.com/spotify/apollo,Java libraries for writing composable microservices,2372,1501,1501,Java,201,920,91,-1,-1,-1
vaadin_spring,https://github.com/vaadin/spring,Spring integration for Vaadin,966,130,130,Java,90,754,89,-1,-1,-1
modernmt_modernmt,https://github.com/modernmt/modernmt,Neural Adaptive Machine Translation that adapts to context and learns from corrections.,61941,136,136,Java,37,3007,41,-1,-1,-1
Wikia_selenium-tests,https://github.com/Wikia/selenium-tests,,253327,146,146,Java,117,17499,248,-1,-1,-1
mcMMO-Dev_mcMMO,https://github.com/mcMMO-Dev/mcMMO,The RPG Lover's Mod!,21273,512,512,Java,447,6912,223,-1,-1,-1
fishercoder1534_Leetcode,https://github.com/fishercoder1534/Leetcode,Complete solutions to Leetcode problems; updated daily. (I'm looking for long-term contributors/partners to this repo! Send me PRs if you're interested! - 9/5/2018),4329,1365,1365,Java,526,3598,34,-1,-1,-1
NightscoutFoundation_xDrip,https://github.com/NightscoutFoundation/xDrip,Nightscout version of xDrip+,27156,382,382,Java,370,4766,84,-1,-1,-1
redisson_redisson,https://github.com/redisson/redisson,"Redisson - Redis Java client with features of In-Memory Data Grid. Supports over 30 objects and services: Set, Multimap, SortedSet, Map, List, Queue, Deque, Semaphore, Lock, AtomicLong, Map Reduce, Publish / Subscribe, Bloom filter, Spring Cache, Tomcat, Scheduler, JCache API, Hibernate, RPC.",12544,9806,9806,Java,2407,5342,173,-1,-1,-1
apache_commons-io,https://github.com/apache/commons-io,Mirror of Apache Commons IO,5562,602,602,Java,392,5529,166,-1,-1,-1
alibaba_fastjson,https://github.com/alibaba/fastjson,:bullettrain_side: A fast JSON parser/generator for Java. (Aliyun Data Lake Analytics https://www.aliyun.com/product/datalakeanalytics powered by fastjson ) ,12646,18439,18439,Java,4997,4160,264,-1,-1,-1
xipki_xipki,https://github.com/xipki/xipki,Highly scalable and high-performance open source PKI (CA and OCSP responder),37692,204,204,Java,46,7455,5,-1,-1,-1
raulhaag_MiMangaNu,https://github.com/raulhaag/MiMangaNu,"*ES - Lector de Manga online / offline, gratuito y de código abierto.  *EN - Manga reader online / offline, free and open source.  *FR - Lecteur de manga en ligne / hors ligne, gratuit et open source.  *DE - Eine App um Manga zu lesen. Man kann damit Manga online und offline lesen. Es ist kostenlos und quelloffen.  *IT - Manga lettore online / offline, gratuito e open source.  *RU - В России Манга читает вас. Попробуйте MiMangaNu прямо сейчас.",7916,198,198,Java,57,1684,33,-1,-1,-1
apache_freemarker,https://github.com/apache/freemarker,Apache Freemarker,16650,445,445,Java,139,3185,44,-1,-1,-1
cdapio_cdap,https://github.com/cdapio/cdap,An open source framework for building data analytic applications.,569583,348,348,Java,179,58664,330,-1,-1,-1
openmrs_openmrs-core,https://github.com/openmrs/openmrs-core,OpenMRS API and web application code,228734,783,783,Java,2383,22360,973,-1,-1,-1
flipkart-incubator_proteus,https://github.com/flipkart-incubator/proteus,Proteus : A JSON based LayoutInflater for Android,3538,940,940,Java,143,1202,19,-1,-1,-1
openMF_android-client,https://github.com/openMF/android-client,An android client for the MifosX platform,101450,109,109,Java,357,6607,310,-1,-1,-1
tuskyapp_Tusky,https://github.com/tuskyapp/Tusky,An Android client for the microblogging server Mastodon,16551,721,721,Java,193,3940,196,-1,-1,-1
vaadin_framework,https://github.com/vaadin/framework,"Vaadin 6, 7, 8   is a Java framework for modern web applications.",328906,1506,1506,Java,701,29507,433,-1,-1,-1
davideas_FlexibleAdapter,https://github.com/davideas/FlexibleAdapter,Fast and versatile Adapter for RecyclerView which regroups several features into one library to considerably improve the user experience :-),10794,3152,3152,Java,495,1092,44,-1,-1,-1
mapstruct_mapstruct,https://github.com/mapstruct/mapstruct,An annotation processor for generating type-safe bean mappers,7974,1834,1834,Java,309,2518,142,-1,-1,-1
MovingBlocks_Terasology,https://github.com/MovingBlocks/Terasology,Terasology - open source voxel world,287939,2597,2597,Java,1165,13112,534,-1,-1,-1
nordic-institute_X-Road,https://github.com/nordic-institute/X-Road,Source code of the X-Road data exchange layer software.,199736,129,129,Java,36,1965,60,-1,-1,-1
willuhn_hibiscus,https://github.com/willuhn/hibiscus,"A Java based, plattform independent (running on Linux, Windows, OS X, OpenBSD, OpenSolaris) homebanking application, that uses the  german FinTS/HBCI standard. All data (accounts, transactions, addresses, ..) are stored encrypted into an embedded database (H2) by default or on a Mysql server (if configured).  Hibiscus runs as a plugin within the Jameica framework as either a typical desktop application or headless in server mode.",178777,150,150,Java,52,3722,38,-1,-1,-1
dessalines_flowchat,https://github.com/dessalines/flowchat,A reddit alternative featuring communities and live-updating threaded conversations.,1837,294,294,Java,33,519,5,-1,-1,-1
micronaut-projects_micronaut-core,https://github.com/micronaut-projects/micronaut-core,Micronaut Application Framework,43223,2561,2561,Java,408,7382,204,-1,-1,-1
DSheirer_sdrtrunk,https://github.com/DSheirer/sdrtrunk,"A cross-platform java application for decoding, monitoring, recording and streaming trunked mobile and related radio protocols using Software Defined Radios (SDR).  Website:",28188,407,407,Java,82,1422,12,-1,-1,-1
dorkbox_SystemTray,https://github.com/dorkbox/SystemTray,"Cross-platform SystemTray support for Swing/AWT, GtkStatusIcon, and AppIndicator on Java 6+",1638,157,157,Java,26,757,6,-1,-1,-1
spring-cloud_spring-cloud-dataflow,https://github.com/spring-cloud/spring-cloud-dataflow,Microservice based Streaming and Batch data processing for Cloud Foundry and Kubernetes,45318,545,545,Java,326,4927,117,-1,-1,-1
openhab_openhab-core,https://github.com/openhab/openhab-core,Core framework of openHAB,16810,126,126,Java,140,1862,68,-1,-1,-1
maskarade_Android-Orma,https://github.com/maskarade/Android-Orma,An ORM for Android with type-safety and painless migrations,3823,437,437,Java,50,1615,34,-1,-1,-1
kairosdb_kairosdb,https://github.com/kairosdb/kairosdb,Fast scalable time series database,47240,1461,1461,Java,302,2344,185,-1,-1,-1
rubenlagus_TelegramBots,https://github.com/rubenlagus/TelegramBots,Java library to create bots using Telegram Bots API,1708,1453,1453,Java,482,939,141,-1,-1,-1
mplushnikov_lombok-intellij-plugin,https://github.com/mplushnikov/lombok-intellij-plugin,Lombok Plugin for IntelliJ IDEA,16907,1919,1919,Java,329,1716,57,-1,-1,-1
OpenHFT_Java-Thread-Affinity,https://github.com/OpenHFT/Java-Thread-Affinity,Bind a java thread to a given core,11369,821,821,Java,210,660,28,-1,-1,-1
mvel_mvel,https://github.com/mvel/mvel,MVEL (MVFLEX Expression Language),14288,571,571,Java,205,5625,113,-1,-1,-1
bbottema_simple-java-mail,https://github.com/bbottema/simple-java-mail,"Simple API, Complex Emails (JavaMail smtp wrapper)",7995,498,498,Java,132,1334,28,-1,-1,-1
CellularPrivacy_Android-IMSI-Catcher-Detector,https://github.com/CellularPrivacy/Android-IMSI-Catcher-Detector,"AIMSICD • Fight IMSI-Catcher, StingRay and silent SMS!",10889,3533,3533,Java,737,5479,187,-1,-1,-1
brianfrankcooper_YCSB,https://github.com/brianfrankcooper/YCSB,Yahoo! Cloud Serving Benchmark,31912,2605,2605,Java,1506,2918,415,-1,-1,-1
razerdp_BasePopup,https://github.com/razerdp/BasePopup,亲，还在为PopupWindow烦恼吗？不如试试BasePopup，你会爱上他的~,20110,3174,3174,Java,530,845,8,-1,-1,-1
dropbox_dropbox-sdk-java,https://github.com/dropbox/dropbox-sdk-java,A Java library for the Dropbox Core API.,33154,360,360,Java,335,598,82,-1,-1,-1
damianszczepanik_cucumber-reporting,https://github.com/damianszczepanik/cucumber-reporting,HTML reports for Cucumber,22430,348,348,Java,286,1504,157,-1,-1,-1
Netflix_eureka,https://github.com/Netflix/eureka,AWS Service registry for resilient mid-tier load balancing and failover.,11740,8012,8012,Java,2212,2854,156,-1,-1,-1
Netflix_dyno,https://github.com/Netflix/dyno,Java client for Dynomite,7219,159,159,Java,80,702,66,-1,-1,-1
katzer_cordova-plugin-local-notifications,https://github.com/katzer/cordova-plugin-local-notifications,Cordova Local-Notification Plugin,42626,2239,2239,Java,1400,1298,191,-1,-1,-1
crossbario_autobahn-java,https://github.com/crossbario/autobahn-java,WebSocket & WAMP in Java for Android and Java 8,5108,1313,1313,Java,411,971,40,-1,-1,-1
joshjdevl_libsodium-jni,https://github.com/joshjdevl/libsodium-jni,(Android) Networking and Cryptography Library (NaCL) JNI binding. JNI is utilized for fastest access to native code. Accessible either in Android or Java application. Uses SWIG to generate Java JNI bindings. SWIG definitions are extensible to other languages.,1515,128,128,Java,65,870,47,-1,-1,-1
northbright_Notes,https://github.com/northbright/Notes,Development Notes,16788,144,144,Java,51,1036,2,-1,-1,-1
lukas-krecan_ShedLock,https://github.com/lukas-krecan/ShedLock,Distributed lock for your scheduled tasks,863,673,673,Java,133,533,31,-1,-1,-1
gsantner_markor,https://github.com/gsantner/markor,Text editor - Notes & ToDo (for Android). Supporting Markdown and todo.txt,14096,570,570,Java,107,3152,131,-1,-1,-1
openzipkin_zipkin,https://github.com/openzipkin/zipkin,Zipkin is a distributed tracing system,46681,11297,11297,Java,2023,6704,325,-1,-1,-1
spring-cloud_spring-cloud-cli,https://github.com/spring-cloud/spring-cloud-cli,Spring Cloud CLI features,240594,112,112,Java,61,2026,31,-1,-1,-1
forge_roaster,https://github.com/forge/roaster,A Java Parser library that allows easy parsing and formatting of Java source files,1666,409,409,Java,76,840,48,-1,-1,-1
MobiVM_robovm,https://github.com/MobiVM/robovm,"Ahead of time compiler for JVM bytecode targetting iOS, Mac OSX and Linux",168211,473,473,Java,84,1330,60,-1,-1,-1
proninyaroslav_libretorrent,https://github.com/proninyaroslav/libretorrent,Free as in Freedom torrent client for Android. Mirrored from https://gitlab.com/proninyaroslav/libretorrent,5937,627,627,Java,118,520,41,-1,-1,-1
guooscar_JazminServer,https://github.com/guooscar/JazminServer,"Java based application,rpc,message,rtmp,game,sip,rtp,relay,webrtc,webssh,proxy server,message  queue,mysql proxy server",288687,202,202,Java,123,839,14,-1,-1,-1
lukas-krecan_JsonUnit,https://github.com/lukas-krecan/JsonUnit,Compare JSON in your Unit Tests,1646,365,365,Java,63,712,26,-1,-1,-1
lerry903_RuoYi,https://github.com/lerry903/RuoYi,基于SpringBoot2.1的权限管理系统 易读易懂、界面简洁美观。 核心技术采用Spring、MyBatis、Shiro没有任何其它重度依赖。直接运行即可用,12505,324,324,Java,116,500,33,-1,-1,-1
apache_apex-malhar,https://github.com/apache/apex-malhar,Mirror of Apache Apex malhar,91929,127,127,Java,151,9483,196,-1,-1,-1
zstackio_zstack,https://github.com/zstackio/zstack,ZStack - the open-source IaaS software http://zstack.org (国内用户请至 http://zstack.io),68845,679,679,Java,264,12159,122,-1,-1,-1
etcd-io_jetcd,https://github.com/etcd-io/jetcd,etcd java client,1550,510,510,Java,165,1056,70,-1,-1,-1
futurice_meeting-room-tablet,https://github.com/futurice/meeting-room-tablet,Google Apps compatible meeting room reservator,4287,155,155,Java,53,754,56,-1,-1,-1
apache_activemq,https://github.com/apache/activemq,Mirror of Apache ActiveMQ,54394,1511,1511,Java,1048,17104,293,-1,-1,-1
owncloud_android,https://github.com/owncloud/android,:phone: The ownCloud Android App,218594,2820,2820,Java,2795,12109,262,-1,-1,-1
NationalSecurityAgency_timely,https://github.com/NationalSecurityAgency/timely,Accumulo backed time series database,5674,322,322,Java,92,949,90,-1,-1,-1
eclipse-vertx_vertx-sql-client,https://github.com/eclipse-vertx/vertx-sql-client,High performance reactive SQL Client written in Java,6123,444,444,Java,57,1173,30,-1,-1,-1
eclipse_rdf4j,https://github.com/eclipse/rdf4j,RDF4J Project,14915,161,161,Java,59,2833,66,-1,-1,-1
bazelbuild_intellij,https://github.com/bazelbuild/intellij,IntelliJ plugin for Bazel projects,113047,301,301,Java,93,757,68,-1,-1,-1
qos-ch_logback,https://github.com/qos-ch/logback,"The reliable, generic, fast and flexible logging framework for Java.",26647,1645,1645,Java,787,5032,474,-1,-1,-1
netty_netty,https://github.com/netty/netty,Netty project - an event-driven asynchronous network application framework,58064,19950,19950,Java,9094,26297,1126,-1,-1,-1
jenkinsci_docker-workflow-plugin,https://github.com/jenkinsci/docker-workflow-plugin,,579,328,328,Java,292,657,138,-1,-1,-1
Grover-c13_PokeGOAPI-Java,https://github.com/Grover-c13/PokeGOAPI-Java,Pokemon Go API,10427,1071,1071,Java,375,2148,141,-1,-1,-1
zolyfarkas_spf4j,https://github.com/zolyfarkas/spf4j,Simple performance framework for java,833522,146,146,Java,16,31993,9,-1,-1,-1
swagger-api_swagger-inflector,https://github.com/swagger-api/swagger-inflector,,4088,102,102,Java,59,786,39,-1,-1,-1
yahoo_fili,https://github.com/yahoo/fili,Easily make RESTful web services for time series reporting with Big Data analytics engines like Druid and SQL Databases.,10864,120,120,Java,63,3106,89,-1,-1,-1
