name,url,description,size,stars,watchers,language,forks,commits,authors,lines_of_code,lines_of_comments,lines_blank
mendhak_gpslogger,https://github.com/mendhak/gpslogger,":satellite: Lightweight GPS Logging Application For Android. Available on the Android Market as ""GPSLogger for Android""",23212,1059,1059,Java,467,1790,62,-1,-1,-1
1hakr_AnExplorer,https://github.com/1hakr/AnExplorer,"📁 Another Android Explorer ( File Manager ) is an All-in-One Open source file manager. AnExplorer File Manager (File Explorer) is designed for all android devices including Phones, Phablets, Tablets, Chromecast, Wear OS, Android TV and Chromebooks. It's a fully designed with Material guidelines by Google.",15242,1085,1085,Java,447,597,13,-1,-1,-1
spotify_docker-client,https://github.com/spotify/docker-client,INACTIVE: A simple docker client for the JVM,3535,1259,1259,Java,485,2553,283,-1,-1,-1
bitcoin-wallet_bitcoin-wallet,https://github.com/bitcoin-wallet/bitcoin-wallet,"Bitcoin Wallet app for your Android device. Standalone Bitcoin node, no centralized backend required.",33345,1797,1797,Java,1329,4773,111,-1,-1,-1
fengjiachun_Jupiter,https://github.com/fengjiachun/Jupiter,"Jupiter是一款性能非常不错的, 轻量级的分布式服务框架",9816,1007,1007,Java,455,1770,24,-1,-1,-1
westnordost_StreetComplete,https://github.com/westnordost/StreetComplete,OSM Surveyor app for Android,97533,1113,1113,Java,114,2449,76,-1,-1,-1
apache_jmeter,https://github.com/apache/jmeter,Apache JMeter,63577,3183,3183,Java,1064,25397,214,-1,-1,-1
EngineHub_WorldEdit,https://github.com/EngineHub/WorldEdit,An in-game voxel map editor for Minecraft,13543,1267,1267,Java,607,4253,258,-1,-1,-1
junit-team_junit5,https://github.com/junit-team/junit5,The next generation of JUnit.,547722,3250,3250,Java,731,13977,447,-1,-1,-1
quartz-scheduler_quartz,https://github.com/quartz-scheduler/quartz,Code for Quartz Scheduler,24491,2901,2901,Java,918,4971,119,-1,-1,-1
ballerina-platform_ballerina-lang,https://github.com/ballerina-platform/ballerina-lang,"Ballerina is a compiled, transactional, statically and strongly typed programming language with textual and graphical syntaxes.",386146,1831,1831,Java,446,73043,468,-1,-1,-1
primefaces_primefaces,https://github.com/primefaces/primefaces,Ultimate Component Suite for JavaServer Faces,55083,1077,1077,Java,530,23419,332,-1,-1,-1
vaadin_framework,https://github.com/vaadin/framework,"Vaadin 6, 7, 8   is a Java framework for modern web applications.",328906,1506,1506,Java,701,29507,433,-1,-1,-1
deeplearning4j_nd4j,https://github.com/deeplearning4j/nd4j,"Fast, Scientific and Numerical Computing for the JVM (NDArrays)",305309,1607,1607,Java,524,10180,167,-1,-1,-1
kframework_k-legacy,https://github.com/kframework/k-legacy,"The K tools (deprecated, see README)",264239,154,154,Java,70,20046,144,-1,-1,-1
SkriptLang_Skript,https://github.com/SkriptLang/Skript,"Skript is a Bukkit plugin which allows server admins to customize their server easily, but without the hassle of programming a plugin or asking/paying someone to program a plugin for them.",14969,275,275,Java,115,2474,88,-1,-1,-1
jlegewie_zotfile,https://github.com/jlegewie/zotfile,"Zotero plugin to manage your attachments: automatically rename, move, and attach PDFs (or other files) to Zotero items, sync PDFs from your Zotero library to your (mobile) PDF reader (e.g. an iPad, Android tablet, etc.), and extract PDF annotations.",9916,730,730,Java,108,1252,66,-1,-1,-1
Choonster-Minecraft-Mods_TestMod3,https://github.com/Choonster-Minecraft-Mods/TestMod3,A Minecraft Forge 1.8 - 1.14.3 mod that I use for testing things,9532,189,189,Java,53,849,4,-1,-1,-1
spring-projects_spring-ldap,https://github.com/spring-projects/spring-ldap,Spring LDAP,24267,206,206,Java,396,1291,65,-1,-1,-1
apache_guacamole-client,https://github.com/apache/guacamole-client,Mirror of Apache Guacamole Client,18188,513,513,Java,238,5668,95,-1,-1,-1
apache_jackrabbit,https://github.com/apache/jackrabbit,Mirror of Apache Jackrabbit,59966,221,221,Java,164,18842,91,-1,-1,-1
vmware_admiral,https://github.com/vmware/admiral,Container management solution with an accent on modeling containerized applications and provide placement based on dynamic policy allocation,32879,198,198,Java,48,4584,80,-1,-1,-1
zalando_nakadi,https://github.com/zalando/nakadi,A distributed event bus that implements a RESTful API abstraction on top of Kafka-like queues,11352,513,513,Java,108,5517,105,-1,-1,-1
oltpbenchmark_oltpbench,https://github.com/oltpbenchmark/oltpbench,Database Benchmarking Framework,83589,237,237,Java,183,2300,124,-1,-1,-1
moonlight-stream_moonlight-android,https://github.com/moonlight-stream/moonlight-android,GameStream client for Android,81548,884,884,Java,217,1688,54,-1,-1,-1
RIPE-NCC_whois,https://github.com/RIPE-NCC/whois,RIPE Database whois code repository,19208,237,237,Java,68,6033,62,-1,-1,-1
rdoeffinger_Dictionary,https://github.com/rdoeffinger/Dictionary,"""QuickDic"" offline Dictionary App for Android. Provided downloadable dictionaries are based on Wiktionaries but can also be created from other sources (see DictionaryPC). Remember to use --recursive when cloning! Fork of project that used to be hosted at code.google.com/p/quickdic-dictionary.",101797,124,124,Java,59,663,35,-1,-1,-1
Talend_tesb-rt-se,https://github.com/Talend/tesb-rt-se,ESB,67609,136,136,Java,177,5600,124,-1,-1,-1
eclipse_eclipse.jdt.core,https://github.com/eclipse/eclipse.jdt.core,JDT/Core project repository (eclipse.jdt.core),128256,157,157,Java,106,34924,205,-1,-1,-1
NucleusPowered_Nucleus,https://github.com/NucleusPowered/Nucleus,The Ultimate Essentials Plugin for Sponge.,9165,113,113,Java,50,3056,38,-1,-1,-1
caojx-git_learn,https://github.com/caojx-git/learn,该仓库主要用于存放学习相关的资料，笔记，项目等,479955,108,108,Java,55,680,9,-1,-1,-1
streamsupport_streamsupport,https://github.com/streamsupport/streamsupport,"Backport of Java 8 java.util.stream API to Java 6/7 and Android, mirrored from",4227,319,319,Java,18,1619,6,-1,-1,-1
Railcraft_Railcraft,https://github.com/Railcraft/Railcraft,"The Railcraft Mod for Minecraft, source and development.",14626,390,390,Java,136,3176,68,-1,-1,-1
willuhn_hibiscus,https://github.com/willuhn/hibiscus,"A Java based, plattform independent (running on Linux, Windows, OS X, OpenBSD, OpenSolaris) homebanking application, that uses the  german FinTS/HBCI standard. All data (accounts, transactions, addresses, ..) are stored encrypted into an embedded database (H2) by default or on a Mysql server (if configured).  Hibiscus runs as a plugin within the Jameica framework as either a typical desktop application or headless in server mode.",178777,150,150,Java,52,3722,38,-1,-1,-1
apache_metamodel,https://github.com/apache/metamodel,Mirror of Apache Metamodel,6862,112,112,Java,111,1688,111,-1,-1,-1
spotify_styx,https://github.com/spotify/styx,"""The path to execution"", Styx is a service that schedules batch data processing jobs in Docker containers on Kubernetes.",7630,149,149,Java,30,4250,41,-1,-1,-1
hypertrack_hypertrack-live-android,https://github.com/hypertrack/hypertrack-live-android,[DEPRECATED] Build live location sharing in your app,50599,610,610,Java,177,1479,21,-1,-1,-1
consp1racy_android-support-preference,https://github.com/consp1racy/android-support-preference,Android Preferences according to Material design specs,4364,335,335,Java,53,580,6,-1,-1,-1
segler-alex_RadioDroid,https://github.com/segler-alex/RadioDroid,radio browser app that uses www.radio-browser.info on android,4016,196,196,Java,74,877,53,-1,-1,-1
garbagemule_MobArena,https://github.com/garbagemule/MobArena,MobArena plugin for Minecraft,20123,113,113,Java,128,1120,61,-1,-1,-1
javadev_underscore-java,https://github.com/javadev/underscore-java,java port of Underscore.js,7936,230,230,Java,52,1143,23,-1,-1,-1
topjohnwu_MagiskManager,https://github.com/topjohnwu/MagiskManager,Companion Android application for Magisk,8594,972,972,Java,203,1722,112,-1,-1,-1
wso2_msf4j,https://github.com/wso2/msf4j,WSO2 Microservices Framework for Java (MSF4J),33088,326,326,Java,315,2705,103,-1,-1,-1
aaronjwood_PortAuthority,https://github.com/aaronjwood/PortAuthority,"A handy systems and security-focused tool, Port Authority is a very fast Android port scanner. Port Authority also allows you to quickly discover hosts on your network and will display useful network information about your device and other hosts.",8750,112,112,Java,35,1005,16,-1,-1,-1
torakiki_pdfsam,https://github.com/torakiki/pdfsam,"PDFsam, a desktop application to extract pages, split, merge, mix and rotate PDF files",9697,731,731,Java,117,1097,12,-1,-1,-1
rickfast_consul-client,https://github.com/rickfast/consul-client,Java Client for Consul HTTP API,1002,433,433,Java,190,786,140,-1,-1,-1
dcm4che_dcm4che,https://github.com/dcm4che/dcm4che,DICOM Implementation in JAVA,58930,515,515,Java,381,3531,115,-1,-1,-1
iotaledger_iota-java,https://github.com/iotaledger/iota-java,JOTA library is a simple Java wrapper around IOTA (http://www.iota.org/) Node's JSON-REST HTTP interface.,4365,118,118,Java,80,655,45,-1,-1,-1
ShifuML_shifu,https://github.com/ShifuML/shifu,An end-to-end machine learning and data mining framework on Hadoop,14139,173,173,Java,87,4178,71,-1,-1,-1
raulhaag_MiMangaNu,https://github.com/raulhaag/MiMangaNu,"*ES - Lector de Manga online / offline, gratuito y de código abierto.  *EN - Manga reader online / offline, free and open source.  *FR - Lecteur de manga en ligne / hors ligne, gratuit et open source.  *DE - Eine App um Manga zu lesen. Man kann damit Manga online und offline lesen. Es ist kostenlos und quelloffen.  *IT - Manga lettore online / offline, gratuito e open source.  *RU - В России Манга читает вас. Попробуйте MiMangaNu прямо сейчас.",7916,198,198,Java,57,1684,33,-1,-1,-1
javaparser_javasymbolsolver,https://github.com/javaparser/javasymbolsolver,*old repository* --> this is now integrated in https://github.com/javaparser/javaparser,9843,252,252,Java,62,1205,34,-1,-1,-1
JavaOPs_topjava,https://github.com/JavaOPs/topjava,Java Enterprise: Maven/ Spring/ Security/ JPA(Hibernate)/ REST(Jackson)/ Bootstrap(CSS)/ jQuery,64,146,146,Java,1660,1247,86,-1,-1,-1
eclipse_golo-lang,https://github.com/eclipse/golo-lang,Golo - a lightweight dynamic language for the JVM.,6241,389,389,Java,91,2707,62,-1,-1,-1
vanilla-music_vanilla,https://github.com/vanilla-music/vanilla,Vanilla Music Player for Android,26520,641,641,Java,229,2532,110,-1,-1,-1
tonyofrancis_Fetch,https://github.com/tonyofrancis/Fetch,The best file downloader library for Android,3201,763,763,Java,129,881,17,-1,-1,-1
jshiell_checkstyle-idea,https://github.com/jshiell/checkstyle-idea,CheckStyle plug-in for IntelliJ IDEA,18292,636,636,Java,111,865,40,-1,-1,-1
rRemix_APlayer,https://github.com/rRemix/APlayer,Android Music Player,217355,450,450,Java,57,870,8,-1,-1,-1
android_android-test,https://github.com/android/android-test,An extensive framework for testing Android apps,56778,538,538,Java,93,904,38,-1,-1,-1
codelibs_fess,https://github.com/codelibs/fess,Fess is very powerful and easily deployable Enterprise Search Server.,41126,389,389,Java,91,4487,52,-1,-1,-1
neo4j-contrib_neo4j-graph-algorithms,https://github.com/neo4j-contrib/neo4j-graph-algorithms,Efficient Graph Algorithms for Neo4j,43307,500,500,Java,130,4869,41,-1,-1,-1
Electrical-Age_ElectricalAge,https://github.com/Electrical-Age/ElectricalAge,Electrical Age (ELN) is a Minecraft Mod offering the ability to perform large-scale in-game electrical simulations.,94009,171,171,Java,97,2323,84,-1,-1,-1
spring-projects_spring-data-couchbase,https://github.com/spring-projects/spring-data-couchbase,Spring Data Couchbase,3108,156,156,Java,123,1641,99,-1,-1,-1
apache_bookkeeper,https://github.com/apache/bookkeeper,Apache Bookkeeper,45819,708,708,Java,279,8206,179,-1,-1,-1
leibnitz27_cfr,https://github.com/leibnitz27/cfr,This is the public repository for the CFR Java decompiler,3997,119,119,Java,19,1498,2,-1,-1,-1
WPIRoboticsProjects_GRIP,https://github.com/WPIRoboticsProjects/GRIP,Program for rapidly developing computer vision applications,68732,272,272,Java,92,2788,48,-1,-1,-1
thelinmichael_spotify-web-api-java,https://github.com/thelinmichael/spotify-web-api-java,A Java wrapper for Spotify's Web API.,12799,333,333,Java,151,971,42,-1,-1,-1
palantir_conjure,https://github.com/palantir/conjure,Strongly typed HTTP/JSON APIs for browsers and microservices,4516,178,178,Java,20,1551,111,-1,-1,-1
kryptco_krypton-android,https://github.com/kryptco/krypton-android,"Krypton turns your Android device into a U2F Authenticator: strong, unphishable 2FA.",15612,151,151,Java,27,607,14,-1,-1,-1
sunnyandgood_BigData,https://github.com/sunnyandgood/BigData,💎🔥大数据学习笔记,331418,122,122,Java,43,714,4,-1,-1,-1
apache_sqoop,https://github.com/apache/sqoop,Mirror of Apache Sqoop,18720,602,602,Java,429,3111,120,-1,-1,-1
jfrog_artifactory-client-java,https://github.com/jfrog/artifactory-client-java,Artifactory REST Client Java API bindings,1442,101,101,Java,103,776,103,-1,-1,-1
apache_tez,https://github.com/apache/tez,Mirror of Apache Tez,26896,232,232,Java,240,3961,72,-1,-1,-1
guooscar_JazminServer,https://github.com/guooscar/JazminServer,"Java based application,rpc,message,rtmp,game,sip,rtp,relay,webrtc,webssh,proxy server,message  queue,mysql proxy server",288687,202,202,Java,123,839,14,-1,-1,-1
mitcc_AlgoSolutions,https://github.com/mitcc/AlgoSolutions,":octocat:LeetCode, LintCode, Project Euler, SGU, HackerRank, Cracking the Coding Interview(ctci):palm_tree:",773,106,106,Java,68,9427,4,-1,-1,-1
jpmml_jpmml-evaluator,https://github.com/jpmml/jpmml-evaluator,Java Evaluator API for PMML,6837,555,555,Java,197,1155,21,-1,-1,-1
martinpaljak_GlobalPlatformPro,https://github.com/martinpaljak/GlobalPlatformPro,Manage applets and keys on JavaCard-s like a pro (via command line or from your Java project),20593,304,304,Java,112,705,32,-1,-1,-1
apache_openmeetings,https://github.com/apache/openmeetings,Mirror of Apache Openmeetings,58707,225,225,Java,120,9862,44,-1,-1,-1
yahoo_athenz,https://github.com/yahoo/athenz,Athenz is a role-based authorization (RBAC) system for provisioning and configuration (centralized authorization) use cases as well as serving/runtime (decentralized authorization) use cases.,9863,326,326,Java,118,1644,54,-1,-1,-1
Intel-bigdata_HiBench,https://github.com/Intel-bigdata/HiBench,HiBench is a big data benchmark suite.,643103,864,864,Java,557,1905,122,-1,-1,-1
samtools_htsjdk,https://github.com/samtools/htsjdk,A Java API for high-throughput sequencing data (HTS) formats.,73846,187,187,Java,214,5240,252,-1,-1,-1
JOML-CI_JOML,https://github.com/JOML-CI/JOML,A Java math library for OpenGL rendering calculations,20482,352,352,Java,69,2347,39,-1,-1,-1
cmu-phil_tetrad,https://github.com/cmu-phil/tetrad,"Repository for the Tetrad Project, www.phil.cmu.edu/tetrad.",40776,140,140,Java,65,4491,36,-1,-1,-1
McJtyMods_RFTools,https://github.com/McJtyMods/RFTools,"A set of blocks and items to help with RF in general. Currently contains a Dimension Builder, Teleportation System, Shield System, RF monitor, an RF network debug tool and an automatic crafter",17249,195,195,Java,85,4298,77,-1,-1,-1
zhanghai_MaterialFiles,https://github.com/zhanghai/MaterialFiles,Material Design file manager for Android,4070,143,143,Java,12,614,3,-1,-1,-1
owlcs_owlapi,https://github.com/owlcs/owlapi,OWL API main repository,163679,423,423,Java,231,4952,66,-1,-1,-1
buchen_portfolio,https://github.com/buchen/portfolio,A simple tool to calculate the overall performance of an investment portfolio.,24769,452,452,Java,141,4399,121,-1,-1,-1
Wikia_selenium-tests,https://github.com/Wikia/selenium-tests,,253327,146,146,Java,117,17499,248,-1,-1,-1
GIScience_openrouteservice,https://github.com/GIScience/openrouteservice,🌍 The open source route planner api with plenty of features.,131932,308,308,Java,77,2874,82,-1,-1,-1
dropbox_dropbox-sdk-java,https://github.com/dropbox/dropbox-sdk-java,A Java library for the Dropbox Core API.,33154,360,360,Java,335,598,82,-1,-1,-1
VKCOM_vk-java-sdk,https://github.com/VKCOM/vk-java-sdk,Java library for working with VK API,2164,203,203,Java,100,575,37,-1,-1,-1
jpmml_jpmml-sklearn,https://github.com/jpmml/jpmml-sklearn,Java library and command-line application for converting Scikit-Learn pipelines to PMML,57876,324,324,Java,68,632,9,-1,-1,-1
mobnetic_BitcoinChecker,https://github.com/mobnetic/BitcoinChecker,DataModule for Bitcoin Checker android app,2997,305,305,Java,199,661,127,-1,-1,-1
pwm-project_pwm,https://github.com/pwm-project/pwm,pwm,133898,454,454,Java,153,2730,79,-1,-1,-1
j-easy_easy-random,https://github.com/j-easy/easy-random,"The simple, stupid random Java beans generator",2564,731,731,Java,116,1225,49,-1,-1,-1
ebraminio_DroidPersianCalendar,https://github.com/ebraminio/DroidPersianCalendar,Android Persian Calendar / تقویم فارسی اندروید ,33559,340,340,Java,137,3100,40,-1,-1,-1
jobxhub_JobX,https://github.com/jobxhub/JobX,"JobX,Let's schedule easy",18470,448,448,Java,183,696,9,-1,-1,-1
FWGS_xash3d-android-project,https://github.com/FWGS/xash3d-android-project,Xash3D Android Project for NDK. ,5084,199,199,Java,35,663,26,-1,-1,-1
zstackio_zstack,https://github.com/zstackio/zstack,ZStack - the open-source IaaS software http://zstack.org (国内用户请至 http://zstack.io),68845,679,679,Java,264,12159,122,-1,-1,-1
ahmetaa_zemberek-nlp,https://github.com/ahmetaa/zemberek-nlp,NLP tools for Turkish.,54301,652,652,Java,139,1319,21,-1,-1,-1
jitsi_jitsi-videobridge,https://github.com/jitsi/jitsi-videobridge,"Jitsi Videobridge is a WebRTC compatible video router or SFU that lets build highly scalable video conferencing infrastructure (i.e., up to hundreds of conferences per server).",164994,947,947,Java,391,3777,118,-1,-1,-1
the-pig-of-jungle_smart-show,https://github.com/the-pig-of-jungle/smart-show,Toast & Snackbar & TopBar & Dialog ,17470,301,301,Java,54,642,7,-1,-1,-1
CompEvol_beast2,https://github.com/CompEvol/beast2,Bayesian Evolutionary Analysis by Sampling Trees,88806,109,109,Java,54,2799,57,-1,-1,-1
griffon_griffon,https://github.com/griffon/griffon,Next generation desktop application development platform for the JVM,817706,243,243,Java,77,3947,43,-1,-1,-1
stanford-futuredata_macrobase,https://github.com/stanford-futuredata/macrobase,MacroBase: A Search Engine for Fast Data,27438,547,547,Java,99,2192,49,-1,-1,-1
takari_polyglot-maven,https://github.com/takari/polyglot-maven,Support alternative markup for Apache Maven POM files,2028,640,640,Java,70,785,49,-1,-1,-1
awslabs_amazon-kinesis-client,https://github.com/awslabs/amazon-kinesis-client,Client library for Amazon Kinesis,1987,456,456,Java,321,997,127,-1,-1,-1
graphaware_neo4j-nlp,https://github.com/graphaware/neo4j-nlp,NLP Capabilities in Neo4j,22031,205,205,Java,42,735,14,-1,-1,-1
apache_commons-collections,https://github.com/apache/commons-collections,Mirror of Apache Commons Collections,18972,363,363,Java,239,5279,129,-1,-1,-1
coinbase_coinbase-java,https://github.com/coinbase/coinbase-java,Coinbase API v1 library for Java,1238,115,115,Java,88,549,37,-1,-1,-1
yandex_clickhouse-jdbc,https://github.com/yandex/clickhouse-jdbc,JDBC driver for ClickHouse,971,304,304,Java,156,770,120,-1,-1,-1
segmentio_analytics-android,https://github.com/segmentio/analytics-android,The hassle-free way to add analytics to your Android app.,44182,277,277,Java,143,1929,74,-1,-1,-1
jmeter-maven-plugin_jmeter-maven-plugin,https://github.com/jmeter-maven-plugin/jmeter-maven-plugin,The JMeter Maven Plugin,1551,300,300,Java,181,996,69,-1,-1,-1
fkzhang_WechatUnrecalled,https://github.com/fkzhang/WechatUnrecalled,,1791347,766,766,Java,243,1374,5,-1,-1,-1
siom79_japicmp,https://github.com/siom79/japicmp,Comparison of two versions of a jar archive,3040,333,333,Java,59,842,46,-1,-1,-1
RikkaApps_FCM-for-Mojo,https://github.com/RikkaApps/FCM-for-Mojo,Firebase Cloud Messaging for Mojo-Webqq.,1441,220,220,Java,29,631,24,-1,-1,-1
andstatus_andstatus,https://github.com/andstatus/andstatus,Multiple accounts client for multiple Social networks. For Android ,28960,197,197,Java,62,2306,33,-1,-1,-1
palatable_lambda,https://github.com/palatable/lambda,Functional patterns for Java,3892,566,566,Java,44,658,12,-1,-1,-1
x-stream_xstream,https://github.com/x-stream/xstream,Serialize Java objects to XML and back again.,20815,439,439,Java,132,3304,55,-1,-1,-1
JetBrains_intellij-sdk-docs,https://github.com/JetBrains/intellij-sdk-docs,IntelliJ SDK Platform Documentation,22000,600,600,Java,409,1864,131,-1,-1,-1
groupon_odo,https://github.com/groupon/odo,A Mock Proxy Server,1678,138,138,Java,21,612,28,-1,-1,-1
cgeo_cgeo,https://github.com/cgeo/cgeo,c:geo - The powerful Android geocaching app.,303581,975,975,Java,501,14282,212,-1,-1,-1
eclipse-vertx_vertx-sql-client,https://github.com/eclipse-vertx/vertx-sql-client,High performance reactive SQL Client written in Java,6123,444,444,Java,57,1173,30,-1,-1,-1
SilenceIM_Silence,https://github.com/SilenceIM/Silence,A fork of Signal with only SMS/MMS encryption.,68261,998,998,Java,164,3036,189,-1,-1,-1
kframework_k,https://github.com/kframework/k,K Framework Tools 5.0,55392,122,122,Java,49,36593,155,-1,-1,-1
adminfaces_admin-template,https://github.com/adminfaces/admin-template,JSF responsive admin template based on Bootstrap and AdminLTE ,1172,126,126,Java,73,542,22,-1,-1,-1
vojtechhabarta_typescript-generator,https://github.com/vojtechhabarta/typescript-generator,"Generates TypeScript from Java - JSON declarations, REST service client",7752,424,424,Java,105,2130,72,-1,-1,-1
Etar-Group_Etar-Calendar,https://github.com/Etar-Group/Etar-Calendar,Android open source calendar,33644,676,676,Java,225,6108,214,-1,-1,-1
CaMnter_AndroidLife,https://github.com/CaMnter/AndroidLife,📔 CaMnter's android learning life and footprint.,82775,277,277,Java,66,1456,8,-1,-1,-1
wbaumann_SmartReceiptsLibrary,https://github.com/wbaumann/SmartReceiptsLibrary,"A customizable, easy-to-use receipt scanner for Android",49758,148,148,Java,65,2734,18,-1,-1,-1
zalando_tracer,https://github.com/zalando/tracer,Call tracing and log correlation in distributed systems,986,111,111,Java,31,593,17,-1,-1,-1
Nukkit_Nukkit,https://github.com/Nukkit/Nukkit,Nukkit is a Nuclear-Powered Server Software For Minecraft: Pocket Edition,10659,724,724,Java,311,5683,265,-1,-1,-1
etcd-io_jetcd,https://github.com/etcd-io/jetcd,etcd java client,1550,510,510,Java,165,1056,70,-1,-1,-1
RS485_LogisticsPipes,https://github.com/RS485/LogisticsPipes,The RS485 take on LogisticsPipes -- ESTḌ 2012,20721,181,181,Java,93,4168,117,-1,-1,-1
boy0001_FastAsyncWorldedit,https://github.com/boy0001/FastAsyncWorldedit,"Blazingly fast world manipulation for artists, large networks and developers: https://www.spigotmc.org/resources/13932/",30243,262,262,Java,197,1589,54,-1,-1,-1
react-native-kit_react-native-track-player,https://github.com/react-native-kit/react-native-track-player,"A fully fledged audio module created for music apps. Provides audio playback, external media controls, chromecast support, background mode and more!",3666,811,811,Java,229,893,83,-1,-1,-1
eclipse_egit,https://github.com/eclipse/egit,Eclipse Git Team Provider (EGit) project repository (egit),57584,131,131,Java,100,19351,223,-1,-1,-1
awslabs_mxnet-model-server,https://github.com/awslabs/mxnet-model-server,Model Server for Apache MXNet is a tool for serving neural net models for inference,37841,475,475,Java,128,2874,63,-1,-1,-1
kongchen_swagger-maven-plugin,https://github.com/kongchen/swagger-maven-plugin,"JAX-RS & SpringMVC supported maven build plugin, helps you generate Swagger JSON and API document in build phase.",2137,588,588,Java,366,1528,216,-1,-1,-1
usdot-fhwa-stol_CARMAPlatform,https://github.com/usdot-fhwa-stol/CARMAPlatform,The newest inception of CARMA is now live on Github and open for collaborating. The CARMAPlatform is created on a robot operating system (ROS) and utilizes open source software (OSS) that enables cooperative automated driving plug-ins. ,35758,151,151,Java,25,5117,28,-1,-1,-1
camel-tooling_camel-idea-plugin,https://github.com/camel-tooling/camel-idea-plugin,Apache Camel Intellij IDEA plugin,19418,112,112,Java,30,1104,18,-1,-1,-1
paritytrading_parity,https://github.com/paritytrading/parity,Open source software platform for trading venues,902,360,360,Java,137,872,8,-1,-1,-1
moneymanagerex_android-money-manager-ex,https://github.com/moneymanagerex/android-money-manager-ex,Android version of Money Manager Ex,31183,235,235,Java,143,4850,44,-1,-1,-1
cinchapi_concourse,https://github.com/cinchapi/concourse,"Distributed database warehouse for transactions, search and analytics across time.",40709,312,312,Java,260,6437,69,-1,-1,-1
arunkumar9t2_lynket-browser,https://github.com/arunkumar9t2/lynket-browser,A better browser for Android using the Custom Tab protocol. Previously called Chromer.,57073,262,262,Java,46,1405,8,-1,-1,-1
praxis-live_praxis-live,https://github.com/praxis-live/praxis-live,PraxisLIVE IDE - (cluster: praxis_live),3108,178,178,Java,9,509,2,-1,-1,-1
bwaldvogel_mongo-java-server,https://github.com/bwaldvogel/mongo-java-server,Fake implementation of MongoDB in Java that speaks the wire protocol.,2153,132,132,Java,37,709,18,-1,-1,-1
saket_Dank,https://github.com/saket/Dank,,7427,650,650,Java,99,1907,6,-1,-1,-1
maoni-app_maoni,https://github.com/maoni-app/maoni,Lightweight library for collecting in-app user feedback from within Android applications.,33332,135,135,Java,30,571,11,-1,-1,-1
JavaMoney_jsr354-ri,https://github.com/JavaMoney/jsr354-ri,JSR 354 - Moneta: Reference Implementation,4265,172,172,Java,74,1089,59,-1,-1,-1
spring-projects_spring-restdocs,https://github.com/spring-projects/spring-restdocs,Test-driven documentation for RESTful services,4393,854,854,Java,534,1275,130,-1,-1,-1
