name,url,description,size,stars,watchers,language,forks,commits,authors,lines_of_code,lines_of_comments,lines_blank
graphql-java_graphql-java,https://github.com/graphql-java/graphql-java,GraphQL Java implementation,5621,3473,3473,Java,610,3942,269,-1,-1,-1
Sable_soot,https://github.com/Sable/soot,Soot - A Java optimization framework,210895,1202,1202,Java,432,6823,205,-1,-1,-1
crate_crate,https://github.com/crate/crate,CrateDB is a distributed SQL database that makes it simple to store and analyze massive amounts of machine data in real-time.,93679,2496,2496,Java,333,24470,144,-1,-1,-1
kairosdb_kairosdb,https://github.com/kairosdb/kairosdb,Fast scalable time series database,47240,1461,1461,Java,302,2344,185,-1,-1,-1
thingsboard_thingsboard,https://github.com/thingsboard/thingsboard,"Open-source IoT Platform - Device management, data collection, processing and visualization.",13033,3788,3788,Java,1281,3034,181,-1,-1,-1
Grover-c13_PokeGOAPI-Java,https://github.com/Grover-c13/PokeGOAPI-Java,Pokemon Go API,10427,1071,1071,Java,375,2148,141,-1,-1,-1
spring-projects_spring-data-redis,https://github.com/spring-projects/spring-data-redis,"Provides support to increase developer productivity in Java when using Redis, a key-value store. Uses familiar Spring concepts such as a template classes for core API usage and lightweight repository style data access.",16222,1002,1002,Java,686,4433,165,-1,-1,-1
hidroh_materialistic,https://github.com/hidroh/materialistic,A material-design Hacker News Android reader,46276,1900,1900,Java,442,1849,34,-1,-1,-1
spring-projects_spring-framework,https://github.com/spring-projects/spring-framework,Spring Framework,136833,30706,30706,Java,19706,33016,1444,-1,-1,-1
panpf_sketch,https://github.com/panpf/sketch,"Sketch 是 Android 上一个强大且全面的图片加载器，支持 GIF，手势缩放以及分块显示超大图片。Sketch is a powerful and comprehensive image loader on Android, with support for GIF, gesture zooming, block display super large image",251405,1249,1249,Java,263,1624,11,-1,-1,-1
jfoenixadmin_JFoenix,https://github.com/jfoenixadmin/JFoenix,JavaFX Material Design Library,27989,4024,4024,Java,791,1359,92,-1,-1,-1
rapidoid_rapidoid,https://github.com/rapidoid/rapidoid,"Rapidoid - Extremely Fast, Simple and Powerful Java Web Framework and HTTP Server!",22435,1418,1418,Java,134,5277,28,-1,-1,-1
apache_shiro,https://github.com/apache/shiro,Mirror of Apache Shiro,24752,2515,2515,Java,1486,4737,124,-1,-1,-1
iBotPeaches_Apktool,https://github.com/iBotPeaches/Apktool,A tool for reverse engineering Android apk files,133752,8435,8435,Java,2167,2855,143,-1,-1,-1
jtablesaw_tablesaw,https://github.com/jtablesaw/tablesaw,Java dataframe and visualization library,34493,1542,1542,Java,322,2440,73,-1,-1,-1
Bigkoo_Android-PickerView,https://github.com/Bigkoo/Android-PickerView,"This is a picker view for android , support linkage effect, timepicker and optionspicker.（时间选择器、省市区三级联动）",6326,10257,10257,Java,2606,553,63,-1,-1,-1
modelmapper_modelmapper,https://github.com/modelmapper/modelmapper,Intelligent object mapping,1656,1143,1143,Java,205,776,79,-1,-1,-1
oshi_oshi,https://github.com/oshi/oshi,Native Operating System and Hardware Information,86310,1017,1017,Java,290,2214,140,-1,-1,-1
lets-blade_blade,https://github.com/lets-blade/blade,:rocket: Lightning fast and elegant mvc framework for Java8,5216,4828,4828,Java,1020,1490,69,-1,-1,-1
opentripplanner_OpenTripPlanner,https://github.com/opentripplanner/OpenTripPlanner,An open source multi-modal trip planner,121732,1325,1325,Java,741,13271,303,-1,-1,-1
spring-cloud_spring-cloud-config,https://github.com/spring-cloud/spring-cloud-config,External configuration (server and client) for Spring Cloud,36688,1360,1360,Java,931,4923,284,-1,-1,-1
apollographql_apollo-android,https://github.com/apollographql/apollo-android,":pager: A strongly-typed, caching GraphQL client for Android, written in Java",140262,1704,1704,Java,314,2743,140,-1,-1,-1
spring-projects_spring-integration-samples,https://github.com/spring-projects/spring-integration-samples,"You are looking for examples, code snippets, sample applications for Spring Integration? This is the place.",12290,1627,1627,Java,2261,914,55,-1,-1,-1
abel533_Mapper,https://github.com/abel533/Mapper,Mybatis Common Mapper - Easy to use,1801,4160,4160,Java,1087,887,70,-1,-1,-1
flyway_flyway,https://github.com/flyway/flyway,Flyway by Boxfuse • Database Migrations Made Easy.,14351,4213,4213,Java,917,4038,422,-1,-1,-1
sanluan_PublicCMS,https://github.com/sanluan/PublicCMS,"CMS written in Java,Safe and fast,Easy support 10 million data, 10 million PV; Currently has 0.0002% of the world's users.Language support English,中文,繁體,日本語",44200,1365,1365,Java,591,925,16,-1,-1,-1
geoserver_geoserver,https://github.com/geoserver/geoserver,Official GeoServer repository,222171,1565,1565,Java,1304,20001,533,-1,-1,-1
EhsanTang_ApiManager,https://github.com/EhsanTang/ApiManager,CRAP - 开源API接口管理平台 | 完全开源、免费使用的API接口管理系统、BUG管理系统：API接口管理、文档管理、数据库表管理、接口调试、浏览器调试插件、导出word&pdf接口…..，采用SpringMVC + MyBatis + Lucene + Bootstrap + Angularjs + Iconfont + Guava Cache ，线上使用地址：http://api.crap.cn,19546,1396,1396,Java,560,1036,18,-1,-1,-1
jmxtrans_jmxtrans,https://github.com/jmxtrans/jmxtrans,jmxtrans,69860,1526,1526,Java,475,2103,252,-1,-1,-1
xerial_sqlite-jdbc,https://github.com/xerial/sqlite-jdbc,SQLite JDBC Driver,193921,1237,1237,Java,302,1262,137,-1,-1,-1
fabric8io_docker-maven-plugin,https://github.com/fabric8io/docker-maven-plugin,Maven plugin for running and creating Docker images,16299,1152,1152,Java,455,3284,272,-1,-1,-1
internetarchive_heritrix3,https://github.com/internetarchive/heritrix3,"Heritrix is the Internet Archive's open-source, extensible, web-scale, archival-quality web crawler project.  ",9817,1509,1509,Java,609,2192,71,-1,-1,-1
skylot_jadx,https://github.com/skylot/jadx,Dex to Java decompiler,13699,19263,19263,Java,2132,1419,71,-1,-1,-1
uber_NullAway,https://github.com/uber/NullAway,A tool to help eliminate NullPointerExceptions (NPEs) in your Java code with low build-time overhead,1668,2561,2561,Java,183,911,20,-1,-1,-1
blynkkk_blynk-server,https://github.com/blynkkk/blynk-server,"Blynk is an Internet of Things Platform aimed to simplify building mobile and web applications for the Internet of Things. Easily connect 400+ hardware models like Arduino, ESP8266, ESP32, Raspberry Pi and similar MCUs and drag-n-drop IOT mobile apps for iOS and Android in 5 minutes",30782,1474,1474,Java,518,8969,40,-1,-1,-1
alibaba_canal,https://github.com/alibaba/canal,阿里巴巴 MySQL binlog 增量订阅&消费组件 ,6902,9443,9443,Java,3256,1719,171,-1,-1,-1
google_tink,https://github.com/google/tink,"Tink is a multi-language, cross-platform, open source library that provides cryptographic APIs that are secure, easy to use correctly, and hard(er) to misuse.",15449,7905,7905,Java,595,2336,106,-1,-1,-1
resilience4j_resilience4j,https://github.com/resilience4j/resilience4j,Resilience4j is a fault tolerance library designed for Java8 and functional programming,4725,3873,3873,Java,461,1941,127,-1,-1,-1
javaee-samples_javaee7-samples,https://github.com/javaee-samples/javaee7-samples,Java EE 7 Samples,4193,2369,2369,Java,1603,1699,109,-1,-1,-1
commonsguy_cw-omnibus,https://github.com/commonsguy/cw-omnibus,Source code to omnibus edition of _The Busy Coder's Guide to Android Development_,75165,4934,4934,Java,3775,1119,24,-1,-1,-1
apache_calcite,https://github.com/apache/calcite,Mirror of Apache Calcite,49309,1279,1279,Java,850,7149,533,-1,-1,-1
JanusGraph_janusgraph,https://github.com/JanusGraph/janusgraph,"JanusGraph: an open-source, distributed graph database",52090,2540,2540,Java,617,6131,196,-1,-1,-1
JSQLParser_JSqlParser,https://github.com/JSQLParser/JSqlParser,JSqlParser parses an SQL statement and translate it into a hierarchy of Java classes. The generated hierarchy can be navigated using the Visitor Pattern,4822,1818,1818,Java,730,1679,171,-1,-1,-1
cryptomator_cryptomator,https://github.com/cryptomator/cryptomator,Multi-platform transparent client-side encryption of your files in the cloud,5772,3161,3161,Java,298,1459,40,-1,-1,-1
gocd_gocd,https://github.com/gocd/gocd,Main repository for GoCD - Continuous Delivery server,288590,5031,5031,Java,791,13528,346,-1,-1,-1
apache_commons-lang,https://github.com/apache/commons-lang,Mirror of Apache Commons Lang,22563,1692,1692,Java,922,11687,374,-1,-1,-1
sherxon_AlgoDS,https://github.com/sherxon/AlgoDS,"Implementation of Algorithms and Data Structures, Problems and Solutions",1573,2941,2941,Java,522,650,26,-1,-1,-1
signalapp_Signal-Server,https://github.com/signalapp/Signal-Server,,1568,1569,1569,Java,563,776,58,-1,-1,-1
google_volley,https://github.com/google/volley,,1176,2407,2407,Java,588,2266,113,-1,-1,-1
DozerMapper_dozer,https://github.com/DozerMapper/dozer,Dozer is a Java Bean to Java Bean mapper that recursively copies data from one object to another. ,21197,1481,1481,Java,399,2286,160,-1,-1,-1
katzer_cordova-plugin-local-notifications,https://github.com/katzer/cordova-plugin-local-notifications,Cordova Local-Notification Plugin,42626,2239,2239,Java,1400,1298,191,-1,-1,-1
UweTrottmann_SeriesGuide,https://github.com/UweTrottmann/SeriesGuide,Track your favorite TV shows and movies on Android devices.,111257,1382,1382,Java,382,10923,26,-1,-1,-1
GoogleChrome_custom-tabs-client,https://github.com/GoogleChrome/custom-tabs-client,Chrome custom tabs examples,13342,1259,1259,Java,307,1829,95,-1,-1,-1
aimacode_aima-java,https://github.com/aimacode/aima-java,"Java implementation of algorithms from Russell And Norvig's ""Artificial Intelligence - A Modern Approach""",701151,1102,1102,Java,615,3869,100,-1,-1,-1
apache_dubbo,https://github.com/apache/dubbo,"Apache Dubbo is a high-performance, java based, open source RPC framework.",19100,27857,27857,Java,18335,9717,974,-1,-1,-1
Alluxio_alluxio,https://github.com/Alluxio/alluxio,"Alluxio, data orchestration for analytics and machine learning in the cloud",114044,4218,4218,Java,2227,63886,1902,-1,-1,-1
remkop_picocli,https://github.com/remkop/picocli,"Parser library and framework to easily build JVM command line applications (Java, Groovy, Kotlin, etc). Usage help with ANSI colors. Autocomplete. Nested subcommands. Annotations and programmatic API. Easy to include as source to avoid adding dependencies.",17904,1337,1337,Java,136,2255,51,-1,-1,-1
ninjaframework_ninja,https://github.com/ninjaframework/ninja,"Ninja is a full stack web framework for Java. Rock solid, fast and super productive.",43978,1846,1846,Java,513,2643,151,-1,-1,-1
apereo_cas,https://github.com/apereo/cas,Apereo CAS - Enterprise Single Sign On for all earthlings and beyond.,1394108,6232,6232,Java,2826,39947,587,-1,-1,-1
lapism_MaterialSearchView,https://github.com/lapism/MaterialSearchView,Material SearchView library.,10157,1973,1973,Java,359,832,52,-1,-1,-1
mybatis_generator,https://github.com/mybatis/generator,A code generator for MyBatis and iBATIS.,39879,3726,3726,Java,1973,1156,79,-1,-1,-1
apache_netbeans,https://github.com/apache/netbeans,Apache NetBeans,175695,1057,1057,Java,409,4553,233,-1,-1,-1
h6ah4i_android-advancedrecyclerview,https://github.com/h6ah4i/android-advancedrecyclerview,"RecyclerView extension library which provides advanced features. (ex. Google's Inbox app like swiping, Play Music app like drag and drop sorting)",8661,4582,4582,Java,820,861,48,-1,-1,-1
pockethub_PocketHub,https://github.com/pockethub/PocketHub,PocketHub Android App,11764,9432,9432,Java,3657,4351,270,-1,-1,-1
apache_storm,https://github.com/apache/storm,Mirror of Apache Storm,178669,5753,5753,Java,3907,16756,786,-1,-1,-1
joelittlejohn_jsonschema2pojo,https://github.com/joelittlejohn/jsonschema2pojo,"Generate Java types from JSON or JSON Schema and annotates those types for data-binding with Jackson, Gson, etc",9650,4575,4575,Java,1253,1565,181,-1,-1,-1
square_wire,https://github.com/square/wire,"Clean, lightweight protocol buffers for Android and Java.",6900,2808,2808,Java,379,2489,122,-1,-1,-1
Netflix_Hystrix,https://github.com/Netflix/Hystrix,"Hystrix is a latency and fault tolerance library designed to isolate points of access to remote systems, services and 3rd party libraries, stop cascading failure and enable resilience in complex distributed systems where failure is inevitable.",9695,17764,17764,Java,3643,2882,277,-1,-1,-1
wix_react-native-navigation,https://github.com/wix/react-native-navigation,A complete native navigation solution for React Native,16513,10490,10490,Java,2282,10733,747,-1,-1,-1
dropwizard_metrics,https://github.com/dropwizard/metrics,:chart_with_upwards_trend: Capturing JVM- and application-level metrics. So you know what's going on.,8868,6591,6591,Java,1633,6186,604,-1,-1,-1
gotev_android-upload-service,https://github.com/gotev/android-upload-service,Easily upload files (FTP / Multipart / Binary) in the background with progress indication notification,15660,2066,2066,Java,568,850,50,-1,-1,-1
google_closure-compiler,https://github.com/google/closure-compiler,A JavaScript checker and optimizer.,152999,5026,5026,Java,927,16211,1192,-1,-1,-1
apache_lucene-solr,https://github.com/apache/lucene-solr,Mirror of Apache Lucene + Solr,405670,2746,2746,Java,1926,91436,714,-1,-1,-1
ankidroid_Anki-Android,https://github.com/ankidroid/Anki-Android,AnkiDroid: Anki on Android,111334,1972,1972,Java,789,10977,318,-1,-1,-1
Tencent_tinker,https://github.com/Tencent/tinker,"Tinker is a hot-fix solution library for Android, it supports dex, library and resources update without reinstall apk.",4317,13930,13930,Java,2811,579,72,-1,-1,-1
zhanghai_Douya,https://github.com/zhanghai/Douya,开源的 Material Design 豆瓣客户端（A Material Design app for douban.com）,24941,4229,4229,Java,1151,1306,2,-1,-1,-1
relayrides_pushy,https://github.com/relayrides/pushy,A Java library for sending APNs (iOS/macOS/Safari) push notifications,7027,1030,1030,Java,283,2043,106,-1,-1,-1
bazelbuild_bazel,https://github.com/bazelbuild/bazel,"a fast, scalable, multi-language and extensible build system",666714,12413,12413,Java,2035,32164,1000,-1,-1,-1
sucese_android-open-source-project-analysis,https://github.com/sucese/android-open-source-project-analysis,Android open source project analysis. Note: The project has been moved to https://github.com/BeesAndroid/BeesAndroid.,121488,2159,2159,Java,372,644,7,-1,-1,-1
Twitter4J_Twitter4J,https://github.com/Twitter4J/Twitter4J,"Twitter4J is an open-sourced, mavenized and Google App Engine safe Java library for the Twitter API which is released under the Apache License 2.0.",11181,2366,2366,Java,1071,2701,246,-1,-1,-1
quarkusio_quarkus,https://github.com/quarkusio/quarkus,Quarkus: Supersonic Subatomic Java. ,24262,2155,2155,Java,319,5229,144,-1,-1,-1
bisq-network_bisq,https://github.com/bisq-network/bisq,The decentralized bitcoin exchange network,235769,2799,2799,Java,855,10871,357,-1,-1,-1
qos-ch_logback,https://github.com/qos-ch/logback,"The reliable, generic, fast and flexible logging framework for Java.",26647,1645,1645,Java,787,5032,474,-1,-1,-1
NLPchina_elasticsearch-sql,https://github.com/NLPchina/elasticsearch-sql,Use SQL to query Elasticsearch,5879,5220,5220,Java,1193,1084,83,-1,-1,-1
hierynomus_sshj,https://github.com/hierynomus/sshj,"ssh, scp and sftp for java",7844,1469,1469,Java,356,1087,103,-1,-1,-1
bumptech_glide,https://github.com/bumptech/glide,An image loading and caching library for Android focused on smooth scrolling,63005,26527,26527,Java,4920,3224,276,-1,-1,-1
osmandapp_Osmand,https://github.com/osmandapp/Osmand,OsmAnd,452044,1930,1930,Java,696,58773,1118,-1,-1,-1
querydsl_querydsl,https://github.com/querydsl/querydsl,Unified Queries for Java,49213,2351,2351,Java,549,8056,207,-1,-1,-1
hamcrest_JavaHamcrest,https://github.com/hamcrest/JavaHamcrest,Java (and original) version of Hamcrest,19230,1619,1619,Java,298,1141,148,-1,-1,-1
b3log_symphony,https://github.com/b3log/symphony,🎶 一款用 Java 实现的现代化社区（论坛/BBS/社交网络/博客）平台。https://hacpai.com,52782,11924,11924,Java,3562,6688,65,-1,-1,-1
apache_ambari,https://github.com/apache/ambari,Mirror of Apache Ambari,341658,1141,1141,Java,1068,42605,499,-1,-1,-1
OpenFeign_feign,https://github.com/OpenFeign/feign,Feign makes writing java http clients easier,2729,4637,4637,Java,945,1958,317,-1,-1,-1
redisson_redisson,https://github.com/redisson/redisson,"Redisson - Redis Java client with features of In-Memory Data Grid. Supports over 30 objects and services: Set, Multimap, SortedSet, Map, List, Queue, Deque, Semaphore, Lock, AtomicLong, Map Reduce, Publish / Subscribe, Bloom filter, Spring Cache, Tomcat, Scheduler, JCache API, Hibernate, RPC.",12544,9806,9806,Java,2407,5342,173,-1,-1,-1
apache_flink,https://github.com/apache/flink,Apache Flink,250456,9436,9436,Java,5059,54071,1724,-1,-1,-1
spring-cloud_spring-cloud-gateway,https://github.com/spring-cloud/spring-cloud-gateway,A Gateway built on Spring Framework 5.x and Spring Boot 2.x providing routing and more.,6368,1684,1684,Java,1080,3009,132,-1,-1,-1
hs-web_hsweb-framework,https://github.com/hs-web/hsweb-framework,"hsweb (haʊs wɛb) 是一个用于快速搭建企业后台管理系统的基础项目,集成一揽子便捷功能如:便捷的通用增删改查,强大的权限管理,动态多数据源,动态表单,在线数据库维护等. 基于 spring-boot,mybaits.",30778,6283,6283,Java,2499,2331,40,-1,-1,-1
JabRef_jabref,https://github.com/JabRef/jabref,Graphical Java application for managing BibTeX and biblatex (.bib) databases,112245,1365,1365,Java,939,21638,529,-1,-1,-1
youtube_api-samples,https://github.com/youtube/api-samples,"Code samples for YouTube APIs, including the YouTube Data API, YouTube Analytics API, and YouTube Live Streaming API. The repo contains language-specific directories that contain the samples.",812,2711,2711,Java,2124,608,89,-1,-1,-1
todoroo_astrid,https://github.com/todoroo/astrid,Astrid: Android's #1 Task Management Application,88840,1070,1070,Java,977,7702,56,-1,-1,-1
apache_drill,https://github.com/apache/drill,Apache Drill,78031,1227,1227,Java,746,9783,379,-1,-1,-1
yasserg_crawler4j,https://github.com/yasserg/crawler4j,Open Source Web Crawler for Java,1183,3601,3601,Java,1735,837,105,-1,-1,-1
apache_skywalking,https://github.com/apache/skywalking,"APM, Application Performance Monitoring System",144501,9516,9516,Java,2647,9649,314,-1,-1,-1
powermock_powermock,https://github.com/powermock/powermock,PowerMock is a Java framework that allows you to unit test code normally regarded as untestable.,5808,2644,2644,Java,451,1877,92,-1,-1,-1
ikarus23_MifareClassicTool,https://github.com/ikarus23/MifareClassicTool,"An Android NFC app for reading, writing, analyzing, etc. MIFARE Classic RFID tags.",4427,1426,1426,Java,460,760,48,-1,-1,-1
k0shk0sh_FastHub,https://github.com/k0shk0sh/FastHub,FastHub the ultimate GitHub client for Android.,20328,4431,4431,Java,636,2309,168,-1,-1,-1
apache_hive,https://github.com/apache/hive,Apache Hive,474082,2621,2621,Java,2583,28822,676,-1,-1,-1
stagemonitor_stagemonitor,https://github.com/stagemonitor/stagemonitor,an open source solution to application performance monitoring for java server applications,10125,1475,1475,Java,245,2208,61,-1,-1,-1
MorphiaOrg_morphia,https://github.com/MorphiaOrg/morphia,MongoDB object-document mapper in Java based on https://github.com/mongodb/mongo-java-driver,63079,1407,1407,Java,404,3296,156,-1,-1,-1
FasterXML_jackson-databind,https://github.com/FasterXML/jackson-databind,General data-binding package for Jackson (2.x): works on streaming API (core) implementation(s),64357,2112,2112,Java,830,5974,370,-1,-1,-1
huanghongxun_HMCL,https://github.com/huanghongxun/HMCL,"A Minecraft Launcher which is multi-functional, cross-platform and popular",16740,1532,1532,Java,231,1496,35,-1,-1,-1
moquette-io_moquette,https://github.com/moquette-io/moquette,Java MQTT lightweight broker,5286,1296,1296,Java,574,1538,98,-1,-1,-1
Swagger2Markup_swagger2markup,https://github.com/Swagger2Markup/swagger2markup,A Swagger to AsciiDoc or Markdown converter to simplify the generation of an up-to-date RESTful API documentation by combining documentation that’s been hand-written with auto-generated API documentation.,4595,1762,1762,Java,291,1212,198,-1,-1,-1
wdullaer_MaterialDateTimePicker,https://github.com/wdullaer/MaterialDateTimePicker,Pick a date or time on Android in style,1979,4106,4106,Java,887,633,112,-1,-1,-1
hawtio_hawtio,https://github.com/hawtio/hawtio,Hawtio web console helps you manage your JVM stuff and stay cool!,96181,1066,1066,Java,451,11523,160,-1,-1,-1
ZXZxin_ZXBlog,https://github.com/ZXZxin/ZXBlog,记录各种学习笔记(算法、Java、数据库、并发......),123182,3048,3048,Java,731,871,1,-1,-1,-1
real-logic_simple-binary-encoding,https://github.com/real-logic/simple-binary-encoding,Simple Binary Encoding (SBE) - High Performance Message Codec,20601,1935,1935,Java,323,2625,107,-1,-1,-1
google_nomulus,https://github.com/google/nomulus,Top-level domain name registry service on Google App Engine,28525,1337,1337,Java,155,2904,81,-1,-1,-1
mapstruct_mapstruct,https://github.com/mapstruct/mapstruct,An annotation processor for generating type-safe bean mappers,7974,1834,1834,Java,309,2518,142,-1,-1,-1
square_okhttp,https://github.com/square/okhttp,"An HTTP client for Android, Kotlin, and Java.",26856,33379,33379,Java,7319,7258,626,-1,-1,-1
pinterest_secor,https://github.com/pinterest/secor,Secor is a service implementing Kafka log persistence,1863,1370,1370,Java,448,1858,227,-1,-1,-1
requery_requery,https://github.com/requery/requery,requery - modern SQL based query & persistence for Java / Kotlin / Android,2913,2842,2842,Java,243,973,61,-1,-1,-1
java-native-access_jna,https://github.com/java-native-access/jna,Java Native Access,405306,5025,5025,Java,1192,4776,318,-1,-1,-1
apache_incubator-heron,https://github.com/apache/incubator-heron,"Apache Heron (Incubating) is a realtime, distributed, fault-tolerant stream processing engine from Twitter",223921,3381,3381,Java,599,13729,245,-1,-1,-1
apache_curator,https://github.com/apache/curator,Apache Curator,9721,1641,1641,Java,764,3333,220,-1,-1,-1
grpc_grpc-java,https://github.com/grpc/grpc-java,The Java gRPC implementation. HTTP/2 based RPC,36226,6221,6221,Java,2005,11252,372,-1,-1,-1
atomix_atomix,https://github.com/atomix/atomix,A reactive Java framework for building fault-tolerant distributed systems,20335,1670,1670,Java,282,6083,64,-1,-1,-1
OpenHFT_Chronicle-Queue,https://github.com/OpenHFT/Chronicle-Queue,Micro second messaging that stores everything to disk,48925,1808,1808,Java,347,5716,95,-1,-1,-1
igniterealtime_Smack,https://github.com/igniterealtime/Smack,A modular and portable open source XMPP client library written in Java for Android and Java (SE) VMs,29242,1980,1980,Java,760,4606,191,-1,-1,-1
rt2zz_react-native-contacts,https://github.com/rt2zz/react-native-contacts,React Native Contacts,815,1070,1070,Java,362,609,129,-1,-1,-1
Pi4J_pi4j,https://github.com/Pi4J/pi4j,"Java I/O library for Raspberry Pi (GPIO, I2C, SPI, UART)",50545,1061,1061,Java,416,1296,103,-1,-1,-1
mission-peace_interview,https://github.com/mission-peace/interview,Interview questions,1200,6893,6893,Java,3431,1304,160,-1,-1,-1
real-logic_aeron,https://github.com/real-logic/aeron,"Efficient reliable UDP unicast, UDP multicast, and IPC message transport",32746,4465,4465,Java,499,9988,96,-1,-1,-1
jitsi_jitsi,https://github.com/jitsi/jitsi,"Jitsi is an audio/video and chat communicator that supports protocols such as SIP, XMPP/Jabber, AIM/ICQ, IRC and many other useful features.",541787,1946,1946,Java,632,13494,172,-1,-1,-1
fishercoder1534_Leetcode,https://github.com/fishercoder1534/Leetcode,Complete solutions to Leetcode problems; updated daily. (I'm looking for long-term contributors/partners to this repo! Send me PRs if you're interested! - 9/5/2018),4329,1365,1365,Java,526,3598,34,-1,-1,-1
ccrama_Slide,https://github.com/ccrama/Slide,"Slide is an open sourced, ad free Reddit browser for Android",126749,1072,1072,Java,244,4183,135,-1,-1,-1
pushtorefresh_storio,https://github.com/pushtorefresh/storio,Reactive API for SQLiteDatabase and ContentResolver.,4427,2639,2639,Java,180,1520,39,-1,-1,-1
crossoverJie_JCSprout,https://github.com/crossoverJie/JCSprout,"👨‍🎓 Java Core Sprout : basic, concurrent, algorithm ",1081,21481,21481,Java,5947,736,48,-1,-1,-1
checkstyle_checkstyle,https://github.com/checkstyle/checkstyle,"Checkstyle is a development tool to help programmers write Java code that adheres to a coding standard. By default it supports the Google Java Style Guide and Sun Code Conventions, but is highly configurable. It can be invoked with an ANT task and a command line program.",64409,4655,4655,Java,6916,18013,458,-1,-1,-1
wildfly_wildfly,https://github.com/wildfly/wildfly,WildFly Application Server,196466,2294,2294,Java,1867,51214,761,-1,-1,-1
CellularPrivacy_Android-IMSI-Catcher-Detector,https://github.com/CellularPrivacy/Android-IMSI-Catcher-Detector,"AIMSICD • Fight IMSI-Catcher, StingRay and silent SMS!",10889,3533,3533,Java,737,5479,187,-1,-1,-1
spring-projects_spring-data-jpa,https://github.com/spring-projects/spring-data-jpa,Simplifies the development of creating a JPA-based data access layer. ,7206,1559,1559,Java,840,3882,195,-1,-1,-1
spring-cloud_spring-cloud-kubernetes,https://github.com/spring-cloud/spring-cloud-kubernetes,"Kubernetes integration with Spring Cloud Discovery Client, Configuration, etc...",1912,1492,1492,Java,374,1021,104,-1,-1,-1
vespa-engine_vespa,https://github.com/vespa-engine/vespa,Vespa is an engine for low-latency computation over large data sets.,96286,2855,2855,Java,339,36221,150,-1,-1,-1
