name,url,description,size,stars,watchers,language,forks,commits,authors,lines_of_code,lines_of_comments,lines_blank
JetBrains_ideavim,https://github.com/JetBrains/ideavim,Vim emulation plug-in for IDEs based on the IntelliJ platform.,8880,4027,4027,Java,429,3179,173,-1,-1,-1
allure-framework_allure2,https://github.com/allure-framework/allure2,"The next generation of Allure Report, a flexible lightweight multi-language test report tool with the possibility to add steps, attachments, parameters and so on.",9709,1220,1220,Java,219,1648,95,-1,-1,-1
stanfordnlp_CoreNLP,https://github.com/stanfordnlp/CoreNLP,Stanford CoreNLP: A Java suite of core NLP tools.,301767,6399,6399,Java,2207,16142,287,-1,-1,-1
mozilla-mobile_focus-android,https://github.com/mozilla-mobile/focus-android,Firefox Focus: The privacy browser - Browse like no one’s watching.,165221,1349,1349,Java,485,6638,208,-1,-1,-1
Jasonette_JASONETTE-Android,https://github.com/Jasonette/JASONETTE-Android,"📡 Native App over HTTP, on Android",1524,1525,1525,Java,200,504,35,-1,-1,-1
j-easy_easy-rules,https://github.com/j-easy/easy-rules,"The simple, stupid rules engine for Java",1425,1505,1505,Java,382,647,43,-1,-1,-1
spring-projects_spring-batch,https://github.com/spring-projects/spring-batch,Spring Batch is a framework for writing offline and batch applications using Spring and Java,91354,1301,1301,Java,1307,8014,308,-1,-1,-1
zendesk_maxwell,https://github.com/zendesk/maxwell,"Maxwell's daemon, a mysql-to-json kafka producer",11657,1537,1537,Java,470,3783,207,-1,-1,-1
brettwooldridge_HikariCP,https://github.com/brettwooldridge/HikariCP,"光 HikariCP・A solid, high-performance, JDBC connection pool at last.",5012,10504,10504,Java,1601,3549,231,-1,-1,-1
spring-projects_spring-data-mongodb,https://github.com/spring-projects/spring-data-mongodb,Provide support to increase developer productivity in Java when using MongoDB. Uses familiar Spring concepts such as a template classes for core API usage and lightweight repository style data access.,20726,1037,1037,Java,770,6711,299,-1,-1,-1
MinecraftForge_MinecraftForge,https://github.com/MinecraftForge/MinecraftForge,Modifications to the Minecraft base files to assist in compatibility between mods.,96756,3187,3187,Java,1494,18592,1203,-1,-1,-1
haifengl_smile,https://github.com/haifengl/smile,Statistical Machine Intelligence & Learning Engine,167193,4412,4412,Java,894,1857,92,-1,-1,-1
connectbot_connectbot,https://github.com/connectbot/connectbot,ConnectBot is the first SSH client for Android.,7189,1280,1280,Java,465,2483,127,-1,-1,-1
apache_tomcat,https://github.com/apache/tomcat,Apache Tomcat,95352,3527,3527,Java,2410,64382,211,-1,-1,-1
apache_incubator-druid,https://github.com/apache/incubator-druid,Apache Druid (Incubating) - Column oriented distributed data store ideal for powering interactive applications,182485,8326,8326,Java,2086,24753,750,-1,-1,-1
javamelody_javamelody,https://github.com/javamelody/javamelody,JavaMelody : monitoring of JavaEE applications,105213,1863,1863,Java,540,7559,62,-1,-1,-1
airbnb_lottie-android,https://github.com/airbnb/lottie-android,"Render After Effects animations natively on Android and iOS, Web, and React Native",133967,26037,26037,Java,4095,2132,156,-1,-1,-1
apache_groovy,https://github.com/apache/groovy,Mirror of Apache Groovy,179079,3299,3299,Java,1252,31259,514,-1,-1,-1
firebase_quickstart-android,https://github.com/firebase/quickstart-android,Firebase Quickstart Samples for Android,27969,5701,5701,Java,5645,1310,116,-1,-1,-1
javaparser_javaparser,https://github.com/javaparser/javaparser, Java 1-12 Parser and Abstract Syntax Tree for Java –,21672,2583,2583,Java,586,6688,226,-1,-1,-1
spring-projects_spring-security-oauth,https://github.com/spring-projects/spring-security-oauth,Support for adding OAuth1(a) and OAuth2 features (consumer and provider) for Spring web applications.,6442,3634,3634,Java,3374,2845,442,-1,-1,-1
openhab_openhab2-addons,https://github.com/openhab/openhab2-addons,Add-ons for openHAB 2.x,358460,1150,1150,Java,2042,31307,1405,-1,-1,-1
fossasia_open-event-droidgen,https://github.com/fossasia/open-event-droidgen,Open Event Android App Generator https://github.com/fossasia/open-event-android/raw/apk/sample-apk-fossasia17-development.apk,76660,1348,1348,Java,849,4376,258,-1,-1,-1
brianfrankcooper_YCSB,https://github.com/brianfrankcooper/YCSB,Yahoo! Cloud Serving Benchmark,31912,2605,2605,Java,1506,2918,415,-1,-1,-1
jindrapetrik_jpexs-decompiler,https://github.com/jindrapetrik/jpexs-decompiler,JPEXS Free Flash Decompiler,112884,1651,1651,Java,322,4783,42,-1,-1,-1
microsoft_malmo,https://github.com/microsoft/malmo,"Project Malmo is a platform for Artificial Intelligence experimentation and research built on top of Minecraft. We aim to inspire a new generation of research into challenging new problems presented by this unique environment. --- For installation instructions, scroll down to *Getting Started* below, or visit the project page for more information:",28789,3295,3295,Java,521,2031,70,-1,-1,-1
sqlcipher_android-database-sqlcipher,https://github.com/sqlcipher/android-database-sqlcipher,Android SQLite API based on SQLCipher,56159,1769,1769,Java,504,644,51,-1,-1,-1
cloudfoundry_uaa,https://github.com/cloudfoundry/uaa,CloudFoundry User Account and Authentication (UAA) Server,53081,1003,1003,Java,651,10626,365,-1,-1,-1
apache_beam,https://github.com/apache/beam,Apache Beam,129689,3068,3068,Java,1855,47978,1086,-1,-1,-1
liquibase_liquibase,https://github.com/liquibase/liquibase,Main Liquibase Source,116636,1788,1788,Java,1089,10351,800,-1,-1,-1
spring-projects_spring-data-elasticsearch,https://github.com/spring-projects/spring-data-elasticsearch,Provide support to increase developer productivity in Java when using Elasticsearch. Uses familiar Spring concepts such as a template classes for core API usage and lightweight repository style data access.,22939,1836,1836,Java,887,2142,240,-1,-1,-1
scribejava_scribejava,https://github.com/scribejava/scribejava,Simple OAuth library for Java,2405,4846,4846,Java,1607,2080,450,-1,-1,-1
Netflix_EVCache,https://github.com/Netflix/EVCache,A distributed in-memory data store for the cloud,2430,1184,1184,Java,174,653,31,-1,-1,-1
reactor_reactor-core,https://github.com/reactor/reactor-core,Non-Blocking Reactive Foundation for the JVM,53413,2444,2444,Java,481,4908,152,-1,-1,-1
square_retrofit,https://github.com/square/retrofit,"Type-safe HTTP client for Android and Java by Square, Inc.",4964,33026,33026,Java,6133,3041,458,-1,-1,-1
limpoxe_Android-Plugin-Framework,https://github.com/limpoxe/Android-Plugin-Framework,Android插件框架，免安装运行插件APK ，支持独立插件和非独立插件,234767,1444,1444,Java,432,1375,16,-1,-1,-1
mpetazzoni_ttorrent,https://github.com/mpetazzoni/ttorrent,BitTorrent Java library with tracker and download client,6822,1082,1082,Java,447,1460,97,-1,-1,-1
androidannotations_androidannotations,https://github.com/androidannotations/androidannotations,Fast Android Development. Easy maintainance.,22289,10833,10833,Java,2451,3509,146,-1,-1,-1
oracle_helidon,https://github.com/oracle/helidon,Java libraries for writing microservices,7427,1453,1453,Java,199,2052,62,-1,-1,-1
SundeepK_CompactCalendarView,https://github.com/SundeepK/CompactCalendarView,An android library which provides a compact calendar view much like the one used in google calenders.,10259,1409,1409,Java,396,633,47,-1,-1,-1
zalando_zalenium,https://github.com/zalando/zalenium,"A flexible and scalable container based Selenium Grid with video recording, live preview, basic auth & dashboard.",13741,1768,1768,Java,370,2941,122,-1,-1,-1
davideas_FlexibleAdapter,https://github.com/davideas/FlexibleAdapter,Fast and versatile Adapter for RecyclerView which regroups several features into one library to considerably improve the user experience :-),10794,3152,3152,Java,495,1092,44,-1,-1,-1
mybatis_spring-boot-starter,https://github.com/mybatis/spring-boot-starter,MyBatis integration with Spring Boot,4198,2594,2594,Java,1148,679,26,-1,-1,-1
linkedin_ambry,https://github.com/linkedin/ambry,Distributed object store,15819,1258,1258,Java,229,5135,61,-1,-1,-1
debezium_debezium,https://github.com/debezium/debezium,Change data capture for a variety of databases. https://debezium.io Please log issues in our JIRA at https://issues.jboss.org/projects/DBZ/issues,8286,1917,1917,Java,507,4412,216,-1,-1,-1
iluwatar_java-design-patterns,https://github.com/iluwatar/java-design-patterns,Design patterns implemented in Java,18740,48989,48989,Java,15907,3512,346,-1,-1,-1
Activiti_Activiti,https://github.com/Activiti/Activiti,"Activiti is a light-weight workflow and Business Process Management (BPM) Platform targeted at business people, developers and system admins. Its core is a super-fast and rock-solid BPMN 2 process engine for Java. It's open-source and distributed under the Apache license. Activiti runs in any Java application, on a server, on a cluster or in the cloud. It integrates perfectly with Spring, it is extremely lightweight and based on simple concepts. ",95403,5388,5388,Java,4390,11451,535,-1,-1,-1
bigbluebutton_bigbluebutton,https://github.com/bigbluebutton/bigbluebutton,Complete open source web conferencing system.,658180,2468,2468,Java,3748,26638,346,-1,-1,-1
mybatis_spring,https://github.com/mybatis/spring,Spring integration for MyBatis 3,11867,1794,1794,Java,1584,1686,97,-1,-1,-1
traccar_traccar,https://github.com/traccar/traccar,Traccar GPS Tracking System,14824,1960,1960,Java,1338,6968,241,-1,-1,-1
square_moshi,https://github.com/square/moshi,A modern JSON library for Kotlin and Java.,1866,5274,5274,Java,392,1301,105,-1,-1,-1
rubenlagus_TelegramBots,https://github.com/rubenlagus/TelegramBots,Java library to create bots using Telegram Bots API,1708,1453,1453,Java,482,939,141,-1,-1,-1
spring-projects_spring-petclinic,https://github.com/spring-projects/spring-petclinic,A sample Spring-based application,7263,3351,3351,Java,6675,2105,354,-1,-1,-1
oracle_visualvm,https://github.com/oracle/visualvm,VisualVM is an All-in-One Java Troubleshooting Tool,356778,1234,1234,Java,163,103503,353,-1,-1,-1
oracle_graal,https://github.com/oracle/graal,GraalVM: Run Programs Faster Anywhere :rocket:,719220,9644,9644,Java,615,41218,295,-1,-1,-1
jboss-javassist_javassist,https://github.com/jboss-javassist/javassist,Java bytecode engineering toolkit,22230,2244,2244,Java,450,986,64,-1,-1,-1
alibaba_atlas,https://github.com/alibaba/atlas,A powerful Android Dynamic Component Framework.,78995,7177,7177,Java,1359,1975,51,-1,-1,-1
eclipse_eclipse-collections,https://github.com/eclipse/eclipse-collections,"Eclipse Collections is a collections framework for Java with optimized data structures and a rich, functional and fluent API.",10640,1094,1094,Java,257,1358,103,-1,-1,-1
brianwernick_ExoMedia,https://github.com/brianwernick/ExoMedia,An Android ExoPlayer wrapper to simplify Audio and Video implementations,2698,1670,1670,Java,321,889,66,-1,-1,-1
classgraph_classgraph,https://github.com/classgraph/classgraph,"An uber-fast, ultra-lightweight, parallelized Java classpath scanner and module scanner.",24839,1317,1317,Java,163,3852,60,-1,-1,-1
b3log_solo,https://github.com/b3log/solo,🎸 一款小而美的博客系统，专为程序员设计。https://hacpai.com/tag/solo,94490,8015,8015,Java,2642,3607,76,-1,-1,-1
junit-team_junit4,https://github.com/junit-team/junit4,A programmer-oriented testing framework for Java.,23457,7532,7532,Java,2800,4468,509,-1,-1,-1
careercup_CtCI-6th-Edition,https://github.com/careercup/CtCI-6th-Edition,Cracking the Coding Interview 6th Ed. Solutions,21487,5045,5045,Java,2369,764,118,-1,-1,-1
plutext_docx4j,https://github.com/plutext/docx4j,"JAXB-based Java library for Word docx, Powerpoint pptx, and Excel xlsx files",115910,1173,1173,Java,963,5429,100,-1,-1,-1
razerdp_BasePopup,https://github.com/razerdp/BasePopup,亲，还在为PopupWindow烦恼吗？不如试试BasePopup，你会爱上他的~,20110,3174,3174,Java,530,845,8,-1,-1,-1
linkedin_cruise-control,https://github.com/linkedin/cruise-control,Cruise-control is the first of its kind to fully automate the dynamic workload rebalance and self-healing of a kafka cluster. It provides great value to Kafka users by simplifying the operation of Kafka clusters.,4850,1189,1189,Java,242,1422,49,-1,-1,-1
rsocket_rsocket-java,https://github.com/rsocket/rsocket-java,Java implementation of RSocket,3809,1060,1060,Java,162,1875,69,-1,-1,-1
facebook_facebook-android-sdk,https://github.com/facebook/facebook-android-sdk,Used to integrate Android apps with Facebook Platform.,26486,4865,4865,Java,2993,1904,325,-1,-1,-1
gephi_gephi,https://github.com/gephi/gephi,Gephi - The Open Graph Viz Platform,514659,3372,3372,Java,1300,5036,153,-1,-1,-1
TheAlgorithms_Java,https://github.com/TheAlgorithms/Java,All Algorithms implemented in Java,1486,15552,15552,Java,5720,2104,524,-1,-1,-1
spotify_apollo,https://github.com/spotify/apollo,Java libraries for writing composable microservices,2372,1501,1501,Java,201,920,91,-1,-1,-1
apache_rocketmq,https://github.com/apache/rocketmq,Mirror of Apache RocketMQ,7357,8295,8295,Java,4267,3779,576,-1,-1,-1
flyingsaucerproject_flyingsaucer,https://github.com/flyingsaucerproject/flyingsaucer,XML/XHTML and CSS 2.1 renderer in pure Java,61612,1308,1308,Java,447,3076,155,-1,-1,-1
web3j_web3j,https://github.com/web3j/web3j,Lightweight Java and Android library for integration with Ethereum clients,7162,2452,2452,Java,859,1945,211,-1,-1,-1
graknlabs_grakn,https://github.com/graknlabs/grakn,Grakn Core: The Knowledge Graph,79713,1650,1650,Java,201,20936,96,-1,-1,-1
TeamAmaze_AmazeFileManager,https://github.com/TeamAmaze/AmazeFileManager,Material design file manager for Android,45691,2558,2558,Java,888,4398,178,-1,-1,-1
json-path_JsonPath,https://github.com/json-path/JsonPath,Java JsonPath implementation,2355,3938,3938,Java,740,1260,161,-1,-1,-1
google_j2objc,https://github.com/google/j2objc,A Java to iOS Objective-C translation tool and runtime.,81253,5472,5472,Java,773,6368,158,-1,-1,-1
TeamNewPipe_NewPipe,https://github.com/TeamNewPipe/NewPipe,A libre lightweight streaming front-end for Android.,27050,6033,6033,Java,920,5329,572,-1,-1,-1
apache_incubator-gobblin,https://github.com/apache/incubator-gobblin,"Gobblin is a distributed big data integration framework (ingestion, replication, compliance, retention)  for batch and streaming systems. Gobblin features integrations with Apache Hadoop, Apache Kafka, Salesforce, S3, MySQL, Google etc.",124676,1562,1562,Java,599,10390,264,-1,-1,-1
looly_hutool,https://github.com/looly/hutool,A set of tools that keep Java sweet.,29942,6201,6201,Java,1999,2267,71,-1,-1,-1
amaembo_streamex,https://github.com/amaembo/streamex,Enhancing Java 8 Streams,4108,1138,1138,Java,125,1260,31,-1,-1,-1
openzipkin_zipkin,https://github.com/openzipkin/zipkin,Zipkin is a distributed tracing system,46681,11297,11297,Java,2023,6704,325,-1,-1,-1
JakeWharton_butterknife,https://github.com/JakeWharton/butterknife,Bind Android views and callbacks to fields and methods.,3814,24201,24201,Java,4564,1622,238,-1,-1,-1
bwssytems_ha-bridge,https://github.com/bwssytems/ha-bridge,"Home automation bridge that emulates a Philips Hue light system and can control other systems such as a Vera, Harmony Hub, Nest, MiLight bulbs or any other system that has an http/https/tcp/udp interface. This is a compact impl to run on small format computers. This is impl started from this project https://github.com/armzilla/amazon-echo-ha-bridge.",3207,1232,1232,Java,169,630,43,-1,-1,-1
OpenTSDB_opentsdb,https://github.com/OpenTSDB/opentsdb,"A scalable, distributed Time Series Database.",37771,3761,3761,Java,1099,5334,371,-1,-1,-1
ratpack_ratpack,https://github.com/ratpack/ratpack,Lean & powerful HTTP apps,23750,1803,1803,Java,366,6654,239,-1,-1,-1
jacoco_jacoco,https://github.com/jacoco/jacoco,:microscope: JaCoCo - Java Code Coverage Library,9116,1731,1731,Java,545,2978,148,-1,-1,-1
wikimedia_apps-android-wikipedia,https://github.com/wikimedia/apps-android-wikipedia, 📱The official Wikipedia app for Android!,199128,1003,1003,Java,326,9938,116,-1,-1,-1
square_javapoet,https://github.com/square/javapoet,A Java API for generating .java source files.,1753,7068,7068,Java,875,1345,164,-1,-1,-1
googlemaps_google-maps-services-java,https://github.com/googlemaps/google-maps-services-java,Java client library for Google Maps API Web Services,5944,1171,1171,Java,743,1233,101,-1,-1,-1
joel-costigliola_assertj-core,https://github.com/joel-costigliola/assertj-core,AssertJ is a library providing easy to use rich typed assertions ,27120,1545,1545,Java,352,4505,380,-1,-1,-1
permissions-dispatcher_PermissionsDispatcher,https://github.com/permissions-dispatcher/PermissionsDispatcher,Simple annotation-based API to handle runtime permissions.,2832,9159,9159,Java,1257,1014,58,-1,-1,-1
halo-dev_halo,https://github.com/halo-dev/halo,✍ Halo 一款现代化的个人独立博客系统,25083,6874,6874,Java,1845,1369,28,-1,-1,-1
guoguibing_librec,https://github.com/guoguibing/librec,"LibRec: A Leading Java Library for Recommender Systems, see",84211,2423,2423,Java,870,1144,60,-1,-1,-1
nutzam_nutz,https://github.com/nutzam/nutz,Nutz -- Web Framework(Mvc/Ioc/Aop/Dao/Json) for ALL Java developer,43659,2121,2121,Java,938,6332,150,-1,-1,-1
jersey_jersey,https://github.com/jersey/jersey,This is no longer the active Jersey repository. Please see the README.md,38964,2894,2894,Java,2538,8715,393,-1,-1,-1
hibernate_hibernate-orm,https://github.com/hibernate/hibernate-orm,Hibernate's core Object/Relational Mapping functionality,166590,3896,3896,Java,2573,24080,1088,-1,-1,-1
zo0r_react-native-push-notification,https://github.com/zo0r/react-native-push-notification,React Native Local and Remote Notifications,792,4096,4096,Java,1143,904,257,-1,-1,-1
sockeqwe_mosby,https://github.com/sockeqwe/mosby,A Model-View-Presenter / Model-View-Intent library for modern Android apps,26542,5233,5233,Java,815,771,75,-1,-1,-1
yeriomin_YalpStore,https://github.com/yeriomin/YalpStore,Download apks from Google Play Store,4454,1685,1685,Java,160,1883,43,-1,-1,-1
fesh0r_fernflower,https://github.com/fesh0r/fernflower,Unofficial mirror of FernFlower Java decompiler (All pulls should be submitted upstream),5507,1501,1501,Java,331,509,53,-1,-1,-1
shopizer-ecommerce_shopizer,https://github.com/shopizer-ecommerce/shopizer,Shopizer java e-commerce software,301345,1323,1323,Java,1225,910,73,-1,-1,-1
bytedeco_javacv,https://github.com/bytedeco/javacv,"Java interface to OpenCV, FFmpeg, and more",5779,3484,3484,Java,989,697,90,-1,-1,-1
nytimes_Store,https://github.com/nytimes/Store,Android Library for Async Data Loading and Caching,2541,3535,3535,Java,313,1006,92,-1,-1,-1
libgdx_libgdx,https://github.com/libgdx/libgdx,Desktop/Android/HTML5/iOS Java game development framework,1040370,15617,15617,Java,5852,18419,1191,-1,-1,-1
cats-oss_android-gpuimage,https://github.com/cats-oss/android-gpuimage,Android filters based on OpenGL (idea from GPUImage for iOS),1258,6222,6222,Java,1772,581,99,-1,-1,-1
mplushnikov_lombok-intellij-plugin,https://github.com/mplushnikov/lombok-intellij-plugin,Lombok Plugin for IntelliJ IDEA,16907,1919,1919,Java,329,1716,57,-1,-1,-1
alibaba_fastjson,https://github.com/alibaba/fastjson,:bullettrain_side: A fast JSON parser/generator for Java. (Aliyun Data Lake Analytics https://www.aliyun.com/product/datalakeanalytics powered by fastjson ) ,12646,18439,18439,Java,4997,4160,264,-1,-1,-1
deeplearning4j_dl4j-examples,https://github.com/deeplearning4j/dl4j-examples,"Deeplearning4j Examples (DL4J, DL4J Spark, DataVec)",352791,1642,1642,Java,1548,2348,191,-1,-1,-1
stleary_JSON-java,https://github.com/stleary/JSON-java,A reference implementation of a JSON package in Java.,883,3313,3313,Java,2207,722,219,-1,-1,-1
PhilJay_MPAndroidChart,https://github.com/PhilJay/MPAndroidChart,"A powerful 🚀 Android chart view / graph view library, supporting line- bar- pie- radar- bubble- and candlestick charts as well as scaling, dragging and animations.",21264,27812,27812,Java,7220,2971,349,-1,-1,-1
amitshekhariitbhu_Fast-Android-Networking,https://github.com/amitshekhariitbhu/Fast-Android-Networking,🚀 A Complete Fast Android Networking Library that also supports HTTP/2 🚀,2806,4451,4451,Java,779,678,26,-1,-1,-1
BuildCraft_BuildCraft,https://github.com/BuildCraft/BuildCraft,BuildCraft,74818,1098,1098,Java,494,10271,410,-1,-1,-1
npgall_cqengine,https://github.com/npgall/cqengine,Ultra-fast SQL-like queries on Java collections,10706,1007,1007,Java,166,2337,36,-1,-1,-1
embulk_embulk,https://github.com/embulk/embulk,Embulk: Pluggable Bulk Data Loader.,6053,1296,1296,Java,162,3277,94,-1,-1,-1
chewiebug_GCViewer,https://github.com/chewiebug/GCViewer,"Fork of tagtraum industries' GCViewer. Tagtraum stopped development in 2008, I aim to improve support for Sun's / Oracle's java 1.6+ garbage collector logs (including G1 collector)",6457,2668,2668,Java,642,800,69,-1,-1,-1
dropwizard_dropwizard,https://github.com/dropwizard/dropwizard,A damn simple library for building production-ready RESTful web services.,97024,7257,7257,Java,3048,7487,736,-1,-1,-1
eclipsesource_J2V8,https://github.com/eclipsesource/J2V8,Java Bindings for V8,4683,1385,1385,Java,220,1028,62,-1,-1,-1
find-sec-bugs_find-sec-bugs,https://github.com/find-sec-bugs/find-sec-bugs,"The SpotBugs plugin for security audits of Java web applications and Android applications. (Also work with Kotlin, Groovy and Scala projects)",6832,1085,1085,Java,267,1196,74,-1,-1,-1
facebook_fresco,https://github.com/facebook/fresco,An Android library for managing images and the memory they use.,68401,15710,15710,Java,3657,3391,458,-1,-1,-1
apache_activemq,https://github.com/apache/activemq,Mirror of Apache ActiveMQ,54394,1511,1511,Java,1048,17104,293,-1,-1,-1
CameraKit_camerakit-android,https://github.com/CameraKit/camerakit-android,Library for Android Camera 1 and 2 APIs. Massively increase stability and reliability of photo and video capture on all Android devices.,21838,4253,4253,Java,662,669,86,-1,-1,-1
undertow-io_undertow,https://github.com/undertow-io/undertow,High performance non-blocking webserver,22677,2438,2438,Java,721,7791,291,-1,-1,-1
aws_aws-sdk-java,https://github.com/aws/aws-sdk-java,The official AWS SDK for Java.,1297414,2974,2974,Java,2255,2835,483,-1,-1,-1
moagrius_TileView,https://github.com/moagrius/TileView,"TileView is a subclass of android.view.ViewGroup that asynchronously displays, pans and zooms tile-based images.  Plugins are available for features like markers, hotspots, and path drawing.",46201,1352,1352,Java,338,589,44,-1,-1,-1
ben-manes_caffeine,https://github.com/ben-manes/caffeine,A high performance caching library for Java 8,17634,6151,6151,Java,546,1186,54,-1,-1,-1
firebase_FirebaseUI-Android,https://github.com/firebase/FirebaseUI-Android,Optimized UI components for Firebase,21488,3474,3474,Java,1495,3948,175,-1,-1,-1
alibaba_Sentinel,https://github.com/alibaba/Sentinel,A lightweight powerful flow control component enabling reliability and monitoring for microservices. (轻量级的流量控制、熔断降级 Java 库),4066,7705,7705,Java,2187,1643,162,-1,-1,-1
zaproxy_zaproxy,https://github.com/zaproxy/zaproxy,The OWASP ZAP core project,180791,5907,5907,Java,1100,8588,206,-1,-1,-1
osmdroid_osmdroid,https://github.com/osmdroid/osmdroid,OpenStreetMap-Tools for Android,108055,1687,1687,Java,756,3925,117,-1,-1,-1
jamesdbloom_mockserver,https://github.com/jamesdbloom/mockserver,"MockServer enables easy mocking of any system you integrate with via HTTP or HTTPS with clients written in Java, JavaScript and Ruby.  MockServer also includes a proxy that introspects all proxied traffic including encrypted SSL traffic and supports Port Forwarding, Web Proxying (i.e. HTTP proxy), HTTPS Tunneling Proxying (using HTTP CONNECT) and SOCKS Proxying (i.e. dynamic port forwarding).",38220,2144,2144,Java,597,2329,113,-1,-1,-1
HoraApps_LeafPic,https://github.com/HoraApps/LeafPic,MIRROR FROM GITLAB! Don't make PR here do it on Gitlab. ,10462,2863,2863,Java,1224,1586,110,-1,-1,-1
apache_ignite,https://github.com/apache/ignite,Mirror of Apache Ignite,374935,2616,2616,Java,1277,96179,816,-1,-1,-1
orbit_orbit,https://github.com/orbit/orbit,Orbit - Virtual actor framework for building distributed systems,7677,1390,1390,Java,154,2399,67,-1,-1,-1
zxing_zxing,https://github.com/zxing/zxing,"ZXing (""Zebra Crossing"") barcode scanning library for Java, Android",239968,23041,23041,Java,8218,6680,312,-1,-1,-1
raphw_byte-buddy,https://github.com/raphw/byte-buddy,Runtime code generation for the Java virtual machine.,874287,2858,2858,Java,369,5201,72,-1,-1,-1
jooby-project_jooby,https://github.com/jooby-project/jooby,The modular micro web framework for Java and Kotlin,55659,1052,1052,Java,138,2830,96,-1,-1,-1
ctripcorp_apollo,https://github.com/ctripcorp/apollo,Apollo（阿波罗）是携程框架部门研发的分布式配置中心，能够集中化管理应用不同环境、不同集群的配置，配置修改后能够实时推送到应用端，并且具备规范的权限、流程治理等特性，适用于微服务配置管理场景。,44784,15419,15419,Java,5445,4218,156,-1,-1,-1
apache_zeppelin,https://github.com/apache/zeppelin,Mirror of Apache Zeppelin,75123,4241,4241,Java,2103,21351,913,-1,-1,-1
pagehelper_Mybatis-PageHelper,https://github.com/pagehelper/Mybatis-PageHelper,Mybatis通用分页插件,4305,7519,7519,Java,2267,598,35,-1,-1,-1
openhab_openhab1-addons,https://github.com/openhab/openhab1-addons,Add-ons for openHAB 1.x,239805,3479,3479,Java,1816,14907,949,-1,-1,-1
pwittchen_ReactiveNetwork,https://github.com/pwittchen/ReactiveNetwork, Android library listening network connection state and Internet connectivity with RxJava Observables,1366,2179,2179,Java,229,756,14,-1,-1,-1
