name,url,description,size,stars,watchers,language,forks,commits,authors,lines_of_code,lines_of_comments,lines_blank
tvrenamer_tvrenamer,https://github.com/tvrenamer/tvrenamer,A Java GUI utility to rename TV episodes from TV listings,62962,115,115,Java,19,3011,25,-1,-1,-1
yeriomin_YalpStore,https://github.com/yeriomin/YalpStore,Download apks from Google Play Store,4454,1685,1685,Java,160,1883,43,-1,-1,-1
OneBusAway_onebusaway-application-modules,https://github.com/OneBusAway/onebusaway-application-modules,The core OneBusAway application suite.,64805,155,155,Java,104,3218,64,-1,-1,-1
usdot-fhwa-stol_CARMAPlatform,https://github.com/usdot-fhwa-stol/CARMAPlatform,The newest inception of CARMA is now live on Github and open for collaborating. The CARMAPlatform is created on a robot operating system (ROS) and utilizes open source software (OSS) that enables cooperative automated driving plug-ins. ,35758,151,151,Java,25,5117,28,-1,-1,-1
prmr_JetUML,https://github.com/prmr/JetUML,A desktop application for fast UML diagramming.,4802,107,107,Java,43,1437,29,-1,-1,-1
hortonworks_streamline,https://github.com/hortonworks/streamline,StreamLine - Streaming Analytics ,69196,136,136,Java,91,9037,363,-1,-1,-1
BuildCraft_BuildCraft,https://github.com/BuildCraft/BuildCraft,BuildCraft,74818,1098,1098,Java,494,10271,410,-1,-1,-1
naturalprogrammer_spring-lemon,https://github.com/naturalprogrammer/spring-lemon,Helper library for Spring Boot web applications,1235,348,348,Java,110,511,5,-1,-1,-1
MyCollab_mycollab,https://github.com/MyCollab/mycollab,"An open source, free, high performance, stable and secure Java Application Business Platform of Project Management and Document",269828,918,918,Java,472,887,14,-1,-1,-1
apache_drill,https://github.com/apache/drill,Apache Drill,78031,1227,1227,Java,746,9783,379,-1,-1,-1
exoplatform_platform,https://github.com/exoplatform/platform,eXo Platform,325449,105,105,Java,130,15084,348,-1,-1,-1
jlegewie_zotfile,https://github.com/jlegewie/zotfile,"Zotero plugin to manage your attachments: automatically rename, move, and attach PDFs (or other files) to Zotero items, sync PDFs from your Zotero library to your (mobile) PDF reader (e.g. an iPad, Android tablet, etc.), and extract PDF annotations.",9916,730,730,Java,108,1252,66,-1,-1,-1
google_j2cl,https://github.com/google/j2cl,Java to Closure JavaScript transpiler,35734,561,561,Java,57,2543,29,-1,-1,-1
ukanth_afwall,https://github.com/ukanth/afwall,AFWall+ (Android Firewall +) - iptables based firewall for Android ,25613,1430,1430,Java,307,1747,38,-1,-1,-1
Atmosphere_nettosphere,https://github.com/Atmosphere/nettosphere,A Java WebSocket/HTTP server based on the Atmosphere and Netty Framework,2778,305,305,Java,76,865,29,-1,-1,-1
mitcc_AlgoSolutions,https://github.com/mitcc/AlgoSolutions,":octocat:LeetCode, LintCode, Project Euler, SGU, HackerRank, Cracking the Coding Interview(ctci):palm_tree:",773,106,106,Java,68,9427,4,-1,-1,-1
SAP_vulnerability-assessment-tool,https://github.com/SAP/vulnerability-assessment-tool,"Analyses your Java and Python applications for open-source dependencies with known vulnerabilities, using both static analysis and testing to determine code context and usage for greater accuracy.  https://sap.github.io/vulnerability-assessment-tool/",38783,248,248,Java,59,722,14,-1,-1,-1
cometd_cometd,https://github.com/cometd/cometd,"The CometD project, a scalable comet (server push) implementation for web messaging.",18920,479,479,Java,192,5472,65,-1,-1,-1
spring-projects_spring-hadoop,https://github.com/spring-projects/spring-hadoop,Spring for Apache Hadoop is a framework for application developers to take advantage of the features of both Hadoop and Spring.,8070,577,577,Java,350,2450,72,-1,-1,-1
google_guava,https://github.com/google/guava,Google core libraries for Java,251505,32627,32627,Java,7298,7936,669,-1,-1,-1
Teradata_kylo,https://github.com/Teradata/kylo,"Kylo is a data lake management software platform and framework for enabling scalable enterprise-class data lakes on big data technologies such as Teradata, Apache Spark and/or  Hadoop. Kylo is licensed under Apache 2.0. Contributed by Teradata Inc.",86798,680,680,Java,320,9549,104,-1,-1,-1
tntim96_JSCover,https://github.com/tntim96/JSCover,"JSCover is a JavaScript Code Coverage Tool that measures line, branch and function coverage",15653,363,363,Java,78,1599,29,-1,-1,-1
pravega_pravega,https://github.com/pravega/pravega,Pravega - Streaming as a new software defined storage primitive,30938,759,759,Java,168,14567,147,-1,-1,-1
git-commit-id_maven-git-commit-id-plugin,https://github.com/git-commit-id/maven-git-commit-id-plugin,Maven plugin which includes build-time git repository information into an POJO / *.properties). Make your apps tell you which version exactly they were built from! Priceless in large distributed deployments... :-),2791,910,910,Java,195,1092,124,-1,-1,-1
apache_commons-collections,https://github.com/apache/commons-collections,Mirror of Apache Commons Collections,18972,363,363,Java,239,5279,129,-1,-1,-1
sparklemotion_nokogiri,https://github.com/sparklemotion/nokogiri,"Nokogiri (鋸) is a Rubygem providing HTML, XML, SAX, and Reader parsers with XPath and CSS selector support.",13514,5232,5232,Java,736,5623,317,-1,-1,-1
vavr-io_vavr,https://github.com/vavr-io/vavr,"VΛVΓ (Vavr, formerly called Javaslang) is a non-commercial, non-profit object-functional library that runs with Java 8+. It aims to reduce the lines of code and increase code quality.",18657,3286,3286,Java,390,5465,175,-1,-1,-1
spring-projects_spring-shell,https://github.com/spring-projects/spring-shell,Spring based interactive shell,6479,411,411,Java,280,757,95,-1,-1,-1
raeleus_skin-composer,https://github.com/raeleus/skin-composer,Create skins for LibGDX scene2d.ui with a graphical interface.,12866,153,153,Java,11,689,7,-1,-1,-1
googlemaps_google-maps-services-java,https://github.com/googlemaps/google-maps-services-java,Java client library for Google Maps API Web Services,5944,1171,1171,Java,743,1233,101,-1,-1,-1
jwtk_jjwt,https://github.com/jwtk/jjwt,Java JWT: JSON Web Token for Java and Android,913,5071,5071,Java,777,597,81,-1,-1,-1
mybatis_mybatis-dynamic-sql,https://github.com/mybatis/mybatis-dynamic-sql,SQL Generator for MyBatis or Spring JDBC Templates,8678,337,337,Java,87,566,11,-1,-1,-1
undertow-io_undertow,https://github.com/undertow-io/undertow,High performance non-blocking webserver,22677,2438,2438,Java,721,7791,291,-1,-1,-1
GoMint_GoMint,https://github.com/GoMint/GoMint,New fresh Minecraft bedrock Server,7708,114,114,Java,29,1735,48,-1,-1,-1
apache_commons-codec,https://github.com/apache/commons-codec,Apache Commons Codec,4359,215,215,Java,132,2437,56,-1,-1,-1
Mantaro_MantaroBot,https://github.com/Mantaro/MantaroBot,Multipurpose Discord bot made in Java using JDA.,11347,198,198,Java,126,3152,56,-1,-1,-1
WildBamaBoy_minecraft-comes-alive,https://github.com/WildBamaBoy/minecraft-comes-alive,"Replaces Minecraft's villagers with humans, who can be interacted with.",14566,102,102,Java,96,1561,36,-1,-1,-1
linkedin_parseq,https://github.com/linkedin/parseq,Asynchronous Java made easier,4330,915,915,Java,238,1052,55,-1,-1,-1
estatio_estatio,https://github.com/estatio/estatio,Estatio Open Source Estate Management built on Apache Isis,47675,174,174,Java,107,5466,23,-1,-1,-1
vaadin_flow,https://github.com/vaadin/flow,Flow is a Java framework binding Vaadin web components to Java. This is part of the Vaadin platform 10+.,128982,202,202,Java,57,32170,240,-1,-1,-1
tmobile_pacbot,https://github.com/tmobile/pacbot,PacBot (Policy as Code Bot),22308,664,664,Java,110,853,52,-1,-1,-1
uniVocity_univocity-parsers,https://github.com/uniVocity/univocity-parsers,"uniVocity-parsers is a suite of extremely fast and reliable parsers for Java. It provides a consistent interface for handling different file formats, and a solid framework for the development of new parsers.",3283,644,644,Java,176,819,24,-1,-1,-1
carlosrafaelgn_FPlayAndroid,https://github.com/carlosrafaelgn/FPlayAndroid,"Simple and straightforward Android music player, with equalizer and bass boost",13449,125,125,Java,63,865,6,-1,-1,-1
eclipse_smarthome,https://github.com/eclipse/smarthome,Eclipse SmartHome™ project,67196,841,841,Java,842,17222,434,-1,-1,-1
FreeTymeKiyan_LeetCode-Sol-Res,https://github.com/FreeTymeKiyan/LeetCode-Sol-Res,"Clean, Understandable Solutions and Resources for LeetCode Online Judge Algorithm Problems. ",5329,1395,1395,Java,637,1173,24,-1,-1,-1
camel-tooling_camel-idea-plugin,https://github.com/camel-tooling/camel-idea-plugin,Apache Camel Intellij IDEA plugin,19418,112,112,Java,30,1104,18,-1,-1,-1
jitsi_jigasi,https://github.com/jitsi/jigasi,Jigasi: a server-side application acting as a gateway to Jitsi Meet conferences. Currently allows regular SIP clients to join meetings and provides transcription capabilities.,111934,122,122,Java,73,650,35,-1,-1,-1
hibernate_hibernate-validator,https://github.com/hibernate/hibernate-validator,Hibernate Validator - Bean Validation 2.0 (JSR 380) Reference Implementation,28897,654,654,Java,390,6856,139,-1,-1,-1
square_retrofit,https://github.com/square/retrofit,"Type-safe HTTP client for Android and Java by Square, Inc.",4964,33026,33026,Java,6133,3041,458,-1,-1,-1
j-easy_easy-batch,https://github.com/j-easy/easy-batch,"The simple, stupid batch framework for Java",23802,374,374,Java,122,1818,37,-1,-1,-1
gk-brown_HTTP-RPC,https://github.com/gk-brown/HTTP-RPC,Lightweight REST for Java,51399,281,281,Java,50,1256,4,-1,-1,-1
find-sec-bugs_find-sec-bugs,https://github.com/find-sec-bugs/find-sec-bugs,"The SpotBugs plugin for security audits of Java web applications and Android applications. (Also work with Kotlin, Groovy and Scala projects)",6832,1085,1085,Java,267,1196,74,-1,-1,-1
griffon_griffon,https://github.com/griffon/griffon,Next generation desktop application development platform for the JVM,817706,243,243,Java,77,3947,43,-1,-1,-1
gchq_Gaffer,https://github.com/gchq/Gaffer,A large-scale entity and relation database supporting aggregation of properties,143242,1534,1534,Java,317,8374,74,-1,-1,-1
bwaldvogel_mongo-java-server,https://github.com/bwaldvogel/mongo-java-server,Fake implementation of MongoDB in Java that speaks the wire protocol.,2153,132,132,Java,37,709,18,-1,-1,-1
liferay_liferay-portal,https://github.com/liferay/liferay-portal,,13288292,1414,1414,Java,2359,573048,1324,-1,-1,-1
spring-projects_spring-security,https://github.com/spring-projects/spring-security,Spring Security,37213,3646,3646,Java,3208,11465,642,-1,-1,-1
spring-projects_spring-security-saml,https://github.com/spring-projects/spring-security-saml,SAML extension for the Spring Security project,7324,327,327,Java,425,1330,106,-1,-1,-1
dice-group_gerbil,https://github.com/dice-group/gerbil,GERBIL - General Entity annotatoR Benchmark ,123885,119,119,Java,41,1288,54,-1,-1,-1
geogebra_geogebra,https://github.com/geogebra/geogebra,GeoGebra trunk (testing),1771514,316,316,Java,96,49009,55,-1,-1,-1
rickfast_consul-client,https://github.com/rickfast/consul-client,Java Client for Consul HTTP API,1002,433,433,Java,190,786,140,-1,-1,-1
amaembo_streamex,https://github.com/amaembo/streamex,Enhancing Java 8 Streams,4108,1138,1138,Java,125,1260,31,-1,-1,-1
commons-app_apps-android-commons,https://github.com/commons-app/apps-android-commons,Upload pictures from Android to Wikimedia Commons. Looking for volunteers! Come say hi at https://groups.google.com/d/forum/commons-app-android and install at https://play.google.com/store/apps/details?id=fr.free.nrw.commons,263045,515,515,Java,674,8669,356,-1,-1,-1
SableCC_sablecc,https://github.com/SableCC/sablecc,SableCC,2299,110,110,Java,20,1693,16,-1,-1,-1
ORCID_ORCID-Source,https://github.com/ORCID/ORCID-Source,ORCID Open Source Project,140366,170,170,Java,65,24912,111,-1,-1,-1
DragonetMC_DragonProxy,https://github.com/DragonetMC/DragonProxy,A proxy to allow Minecraft: Bedrock clients to connect to Minecraft: Java Edition servers.,13784,542,542,Java,114,1090,67,-1,-1,-1
AlmasB_FXGL,https://github.com/AlmasB/FXGL,Java / JavaFX / Kotlin Game Library (Engine),62862,1015,1015,Java,142,3012,24,-1,-1,-1
QuickBlox_q-municate-android,https://github.com/QuickBlox/q-municate-android,Qmunicate Android chat application,200000,242,242,Java,199,2498,38,-1,-1,-1
wso2_msf4j,https://github.com/wso2/msf4j,WSO2 Microservices Framework for Java (MSF4J),33088,326,326,Java,315,2705,103,-1,-1,-1
novoda_no-player,https://github.com/novoda/no-player, Simplified Player wrapper for MediaPlayer and ExoPlayer,2859,153,153,Java,23,1515,31,-1,-1,-1
TryGhost_Ghost-Android,https://github.com/TryGhost/Ghost-Android,🤖 Ghost for Android,12401,170,170,Java,40,730,45,-1,-1,-1
mapbox_mapbox-java,https://github.com/mapbox/mapbox-java,The Mapbox Java SDK – Java wrappers around Mapbox APIs and other location data ,18755,228,228,Java,72,2091,82,-1,-1,-1
FasterXML_jackson-dataformats-binary,https://github.com/FasterXML/jackson-dataformats-binary,"Uber-project for standard Jackson binary format backends: avro, cbor, protobuf, smile",3995,146,146,Java,49,804,39,-1,-1,-1
eclipse_egit,https://github.com/eclipse/egit,Eclipse Git Team Provider (EGit) project repository (egit),57584,131,131,Java,100,19351,223,-1,-1,-1
FINRAOS_herd,https://github.com/FINRAOS/herd,Herd is a managed data lake for the cloud. The Herd unified data catalog helps separate storage from compute in the cloud. Manage petabytes of data and make it accessible for data processing and analytical purposes by any cloud compute platform. ,173657,112,112,Java,32,2666,67,-1,-1,-1
spring-cloud_spring-cloud-consul,https://github.com/spring-cloud/spring-cloud-consul,Spring Cloud Consul,74665,573,573,Java,391,2338,136,-1,-1,-1
koral--_android-gif-drawable,https://github.com/koral--/android-gif-drawable,Views and Drawable for displaying animated GIFs on Android,5742,7520,7520,Java,1564,1258,31,-1,-1,-1
spring-projects_spring-integration-samples,https://github.com/spring-projects/spring-integration-samples,"You are looking for examples, code snippets, sample applications for Spring Integration? This is the place.",12290,1627,1627,Java,2261,914,55,-1,-1,-1
hankcs_HanLP,https://github.com/hankcs/HanLP,自然语言处理 中文分词 词性标注 命名实体识别 依存句法分析 新词发现  关键词短语提取 自动摘要 文本分类聚类 拼音简繁,54509,13852,13852,Java,3953,1333,63,-1,-1,-1
AEFeinstein_mtg-familiar,https://github.com/AEFeinstein/mtg-familiar,An Android app for all things Magic: The Gathering,644542,203,203,Java,67,1770,38,-1,-1,-1
opendistro-for-elasticsearch_security,https://github.com/opendistro-for-elasticsearch/security,Open Distro for Elasticsearch Security plugin,601,225,225,Java,47,1286,40,-1,-1,-1
AriaLyy_Aria,https://github.com/AriaLyy/Aria,下载可以很简单,36528,2635,2635,Java,413,705,11,-1,-1,-1
apache_kafka,https://github.com/apache/kafka,Mirror of Apache Kafka,85353,12757,12757,Java,6843,41562,1823,-1,-1,-1
sunlet_jplugin,https://github.com/sunlet/jplugin,Server side plugin framework for java,17113,103,103,Java,42,549,5,-1,-1,-1
diffplug_spotless,https://github.com/diffplug/spotless,Keep your code spotless,30761,724,724,Java,91,1767,105,-1,-1,-1
javahongxi_whatsmars,https://github.com/javahongxi/whatsmars,Java生态研究(Spring Boot + Redis + Dubbo + RocketMQ + Elasticsearch)🔥🔥🔥🔥🔥,12192,813,813,Java,343,1141,11,-1,-1,-1
Netflix_Priam,https://github.com/Netflix/Priam,"Co-Process for backup/recovery, Token Management, and Centralized Configuration management for Cassandra.",11958,940,940,Java,263,2989,142,-1,-1,-1
mysql_mysql-connector-j,https://github.com/mysql/mysql-connector-j,MySQL Connector/J,26661,353,353,Java,262,2812,80,-1,-1,-1
TheAlgorithms_Java,https://github.com/TheAlgorithms/Java,All Algorithms implemented in Java,1486,15552,15552,Java,5720,2104,524,-1,-1,-1
jsonld-java_jsonld-java,https://github.com/jsonld-java/jsonld-java,JSON-LD implementation for Java,2475,284,284,Java,128,905,51,-1,-1,-1
cbeust_testng,https://github.com/cbeust/testng,TestNG testing framework,29550,1299,1299,Java,756,5223,309,-1,-1,-1
googleapis_cloud-bigtable-client,https://github.com/googleapis/cloud-bigtable-client,Java libraries and HBase client extensions for accessing Google Cloud Bigtable,11928,113,113,Java,124,5344,123,-1,-1,-1
hundeva_Lean-Launcher,https://github.com/hundeva/Lean-Launcher,Pixel Launcher with a few added useful options,122776,427,427,Java,86,19946,240,-1,-1,-1
datacleaner_DataCleaner,https://github.com/datacleaner/DataCleaner,The premier open source Data Quality solution,170285,262,262,Java,104,7634,84,-1,-1,-1
VocabHunter_VocabHunter,https://github.com/VocabHunter/VocabHunter,VocabHunter helps learners of foreign languages find vital new vocabulary to study.,5809,150,150,Java,48,802,6,-1,-1,-1
hs-web_hsweb-framework,https://github.com/hs-web/hsweb-framework,"hsweb (haʊs wɛb) 是一个用于快速搭建企业后台管理系统的基础项目,集成一揽子便捷功能如:便捷的通用增删改查,强大的权限管理,动态多数据源,动态表单,在线数据库维护等. 基于 spring-boot,mybaits.",30778,6283,6283,Java,2499,2331,40,-1,-1,-1
jolie_jolie,https://github.com/jolie/jolie,The Jolie Language Interpreter,122080,151,151,Java,28,4142,51,-1,-1,-1
pentaho_pentaho-platform,https://github.com/pentaho/pentaho-platform,Pentaho BA Server Core,166920,366,366,Java,645,12796,379,-1,-1,-1
caprica_vlcj,https://github.com/caprica/vlcj,Java framework for the vlc media player,86032,621,621,Java,222,2848,17,-1,-1,-1
meganz_android,https://github.com/meganz/android,MEGA Android App,78575,419,419,Java,164,6815,40,-1,-1,-1
sinkillerj_ProjectE,https://github.com/sinkillerj/ProjectE,ProjectE. A complete rewrite of EE2 for modern Minecraft versions.,9321,232,232,Java,153,2756,124,-1,-1,-1
jersey_jersey,https://github.com/jersey/jersey,This is no longer the active Jersey repository. Please see the README.md,38964,2894,2894,Java,2538,8715,393,-1,-1,-1
deeplearning4j_dl4j-examples,https://github.com/deeplearning4j/dl4j-examples,"Deeplearning4j Examples (DL4J, DL4J Spark, DataVec)",352791,1642,1642,Java,1548,2348,191,-1,-1,-1
terrier-org_terrier-core,https://github.com/terrier-org/terrier-core,Terrier IR Platform,5888,106,106,Java,26,1006,14,-1,-1,-1
ferstl_depgraph-maven-plugin,https://github.com/ferstl/depgraph-maven-plugin,"A Maven plugin that generates dependency graphs in various formats (DOT, GML, PlantUML, JSON and Text)",3045,176,176,Java,30,1039,10,-1,-1,-1
google_mug,https://github.com/google/mug,,4122,135,135,Java,23,1216,9,-1,-1,-1
haifengl_smile,https://github.com/haifengl/smile,Statistical Machine Intelligence & Learning Engine,167193,4412,4412,Java,894,1857,92,-1,-1,-1
couchbase_couchbase-elasticsearch-connector,https://github.com/couchbase/couchbase-elasticsearch-connector,The Official Couchbase Elasticsearch Connector,2693,143,143,Java,89,653,38,-1,-1,-1
ForgeEssentials_ForgeEssentials,https://github.com/ForgeEssentials/ForgeEssentials,Repository for ForgeEssentials 1.x,48163,229,229,Java,131,4992,115,-1,-1,-1
apache_incubator-edgent,https://github.com/apache/incubator-edgent,Mirror of Apache Edgent (Incubating),25324,158,158,Java,129,1561,50,-1,-1,-1
actframework_actframework,https://github.com/actframework/actframework,An easy to use Java MVC server stack,15556,568,568,Java,101,2306,10,-1,-1,-1
yandex_clickhouse-jdbc,https://github.com/yandex/clickhouse-jdbc,JDBC driver for ClickHouse,971,304,304,Java,156,770,120,-1,-1,-1
Camelcade_Perl5-IDEA,https://github.com/Camelcade/Perl5-IDEA,Perl5 plugins for IntelliJ IDEA,60654,290,290,Java,50,5438,28,-1,-1,-1
apache_tika,https://github.com/apache/tika,Mirror of Apache Tika,151723,846,846,Java,468,8958,277,-1,-1,-1
logstash_logstash-logback-encoder,https://github.com/logstash/logstash-logback-encoder,Logback JSON encoder and appenders,1316,1380,1380,Java,275,706,90,-1,-1,-1
spotify_helios,https://github.com/spotify/helios,Docker container orchestration platform,7637,2006,2006,Java,229,5054,113,-1,-1,-1
Whiley_WhileyCompiler,https://github.com/Whiley/WhileyCompiler,The Whiley Compiler (WyC),42853,152,152,Java,26,7768,27,-1,-1,-1
gitlab4j_gitlab4j-api,https://github.com/gitlab4j/gitlab4j-api,GitLab4J API (gitlab4j-api) provides a full featured Java client library for working with GitLab repositories via the GitLab REST API,2277,265,265,Java,137,1729,107,-1,-1,-1
aNNiMON_Lightweight-Stream-API,https://github.com/aNNiMON/Lightweight-Stream-API,Stream API from Java 8 rewritten on iterators for Java 7 and below,1791,1463,1463,Java,111,663,35,-1,-1,-1
zalando_riptide,https://github.com/zalando/riptide,Client-side response routing for Spring,5521,111,111,Java,22,1621,31,-1,-1,-1
mekanism_Mekanism,https://github.com/mekanism/Mekanism,A mod for Minecraft,64276,467,467,Java,275,6374,231,-1,-1,-1
couchbase_couchbase-lite-android,https://github.com/couchbase/couchbase-lite-android,"Lightweight, embedded, syncable NoSQL database engine for Android.",75013,1118,1118,Java,212,4322,77,-1,-1,-1
glob3mobile_g3m,https://github.com/glob3mobile/g3m,The multiplatform advanced visualization framework,653396,110,110,Java,55,12890,97,-1,-1,-1
openhab_openhab2-addons,https://github.com/openhab/openhab2-addons,Add-ons for openHAB 2.x,358460,1150,1150,Java,2042,31307,1405,-1,-1,-1
evernote_android-job,https://github.com/evernote/android-job,Android library to handle jobs in the background.,1681,5253,5253,Java,523,562,50,-1,-1,-1
spring-projects_spring-data-envers,https://github.com/spring-projects/spring-data-envers,Envers extension of the Spring Data JPA module,978,172,172,Java,72,502,39,-1,-1,-1
relayrides_pushy,https://github.com/relayrides/pushy,A Java library for sending APNs (iOS/macOS/Safari) push notifications,7027,1030,1030,Java,283,2043,106,-1,-1,-1
klarna_HiveRunner,https://github.com/klarna/HiveRunner,An Open Source unit test framework for hadoop hive queries based on JUnit4,1199,167,167,Java,57,639,38,-1,-1,-1
Floens_Clover,https://github.com/Floens/Clover,Clover - imageboard browser for Android,44904,617,617,Java,238,2118,80,-1,-1,-1
JabRef_jabref,https://github.com/JabRef/jabref,Graphical Java application for managing BibTeX and biblatex (.bib) databases,112245,1365,1365,Java,939,21638,529,-1,-1,-1
hangum_TadpoleForDBTools,https://github.com/hangum/TadpoleForDBTools,,183538,498,498,Java,149,3775,55,-1,-1,-1
ibinti_bugvm,https://github.com/ibinti/bugvm,This is BugVM,1556686,343,343,Java,51,3651,46,-1,-1,-1
anthonyraymond_joal,https://github.com/anthonyraymond/joal,An open source command line RatioMaster with an optional WebUI.,12413,106,106,Java,11,529,4,-1,-1,-1
neo4j_neo4j-ogm,https://github.com/neo4j/neo4j-ogm,Java Object-Graph Mapping Library for Neo4j,14113,209,209,Java,118,2905,87,-1,-1,-1
boy0001_FastAsyncWorldedit,https://github.com/boy0001/FastAsyncWorldedit,"Blazingly fast world manipulation for artists, large networks and developers: https://www.spigotmc.org/resources/13932/",30243,262,262,Java,197,1589,54,-1,-1,-1
linqs_psl,https://github.com/linqs/psl,The PSL software from the University of Maryland and the University of California Santa Cruz,5980,220,220,Java,79,1305,34,-1,-1,-1
mopub_mopub-android-sdk,https://github.com/mopub/mopub-android-sdk,,7345,432,432,Java,469,770,215,-1,-1,-1
hypertrack_hypertrack-live-android,https://github.com/hypertrack/hypertrack-live-android,[DEPRECATED] Build live location sharing in your app,50599,610,610,Java,177,1479,21,-1,-1,-1
eclipse_lsp4j,https://github.com/eclipse/lsp4j,,2086,175,175,Java,53,541,39,-1,-1,-1
microsoft_vscode-java-test,https://github.com/microsoft/vscode-java-test,Run and debug Java test cases in Visual Studio Code.,7338,110,110,Java,29,1304,27,-1,-1,-1
marschall_memoryfilesystem,https://github.com/marschall/memoryfilesystem,An in memory implementation of a JSR-203 file system,2007,153,153,Java,26,727,11,-1,-1,-1
checkstyle_checkstyle,https://github.com/checkstyle/checkstyle,"Checkstyle is a development tool to help programmers write Java code that adheres to a coding standard. By default it supports the Google Java Style Guide and Sun Code Conventions, but is highly configurable. It can be invoked with an ANT task and a command line program.",64409,4655,4655,Java,6916,18013,458,-1,-1,-1
HoraApps_LeafPic,https://github.com/HoraApps/LeafPic,MIRROR FROM GITLAB! Don't make PR here do it on Gitlab. ,10462,2863,2863,Java,1224,1586,110,-1,-1,-1
GoogleCloudPlatform_cloud-bigtable-examples,https://github.com/GoogleCloudPlatform/cloud-bigtable-examples,Examples of how to use Cloud Bigtable both with GCE map/reduce as well as stand alone applications.,1342,161,161,Java,165,1049,62,-1,-1,-1
ShifuML_shifu,https://github.com/ShifuML/shifu,An end-to-end machine learning and data mining framework on Hadoop,14139,173,173,Java,87,4178,71,-1,-1,-1
quickfix-j_quickfixj,https://github.com/quickfix-j/quickfixj,The official QuickFIX/J project repository,39611,492,492,Java,354,2158,119,-1,-1,-1
eclipse_jgit,https://github.com/eclipse/jgit,JGit project repository (jgit),43221,755,755,Java,403,24401,400,-1,-1,-1
gateship-one_odyssey,https://github.com/gateship-one/odyssey,Odyssey music player,9679,123,123,Java,27,1306,22,-1,-1,-1
llbit_chunky,https://github.com/llbit/chunky,Minecraft mapping and rendering tool,12083,263,263,Java,32,1526,22,-1,-1,-1
geoserver_geoserver,https://github.com/geoserver/geoserver,Official GeoServer repository,222171,1565,1565,Java,1304,20001,533,-1,-1,-1
adminfaces_admin-template,https://github.com/adminfaces/admin-template,JSF responsive admin template based on Bootstrap and AdminLTE ,1172,126,126,Java,73,542,22,-1,-1,-1
libgdx_libgdx,https://github.com/libgdx/libgdx,Desktop/Android/HTML5/iOS Java game development framework,1040370,15617,15617,Java,5852,18419,1191,-1,-1,-1
jamesagnew_hapi-fhir,https://github.com/jamesagnew/hapi-fhir,HAPI FHIR - Java API for HL7 FHIR Clients and Servers,689957,820,820,Java,714,6070,202,-1,-1,-1
